file_id,user_id,subforum_id,num_contexts,label_text,sentence,label
30691218_2,572096,1362,3,hate,We need more of our kids on the honor role and in college  crowding out the non-W 's !,1
30410685_1,735180,1388,0,hate,I pm 'd you a suggestion of a place to go  I do not want to post it here as I think non-whites read this site and will then proceed to try and move there .,1
31402537_3,572176,1346,0,hate,Just watch them at North America and they like all black sport players and their `` slang '' .,1
13504803_5,586601,1395,0,hate,Prostitution and drug is getting everywhere  dealers are from Senegal  Guinea  Nigeria  dirty prostitutes are fom Cameroun .,1
30741799_1,625728,1354,1,hate,Wasn't there something like a big bang in which a burrito exploded and all the beans flew everywhere and started reproducing exponentially ?,1
14664558_1,574356,1371,0,hate,Something must be done to halt this terrible wave of immigrants entering Britain .,1
13401474_3,581236,1345,2,hate,No white person should send a single penny or lift a single finger to help them .,1
13592619_2,589795,1393,0,hate,Thank Odin they do n't try to come in the modern day .,1
31709840_1,608629,1363,1,hate,Or try yelling * * * * the nigs ya 'll get suspended  jumped and hopefully some new wn friends or ya 'll die trying. lol Rohawa its a battle cry .,1
13859132_1,589430,1391,0,hate,Typical i suppose in the eyes of the law he is just another tourist beaten on sydneys streets oh yeah and we all know if it was a poor black fella bashed it would be on the news for weeks on end and mr whitey would be branded a big bad evil racist,1
14081846_1,578492,1383,1,hate,They are beating each other to death everywhere  just look what they do to each other in Africa .,1
13858325_1,590316,1391,0,hate,When I look at the Zimbawee 's Mugabe  I think `` Ape '' or `` Gorilla '' .,1
30679925_1,580921,1362,0,hate,There are lots of brown and black kids in the system gays could adopt .,1
14671829_7,573247,1371,5,hate,Want a libtard to support White Nationalism ?,1
30771611_2,572847,1354,2,hate,Like the parasites they are they simply moved to a new host  to continue their destruction of Western White civilization and culture,1
14026780_2,574902,1387,1,hate,Thank the Gods she has chosen to go with her own kind .,1
13480119_2,577495,1345,0,hate,God bless them all  to hell with the blacks .,1
13854327_1,587508,1391,0,hate,You cant expect those poor underprivilidged blacks to have to put up with this cold weather .,1
31760414_1,633578,1363,0,hate,Looking at your guys situation makes me realise how lucky I am that my high school is 100 % white however even in my remote countryside community there are more and more black 's moving into the area  and their kids .,1
30631655_3,576450,1359,0,hate,That negro 's place is in Africa  and the teacher did n't send him there .,1
14670440_1,579759,1371,2,hate,When the wheel hits the road  it wo n't matter if you swing for yellow or black  just that you swing from the nearest overpass .,1
30457365_1,575397,1388,0,hate,The problem is there 's so many white liberal self hating traitors on the same side as the Jews and nonwhites .,1
30654947_2,578687,1359,0,hate,I wish they 'd all bugger off back to the Sudan  Nigeria  Ethiopia or where ever the hell it is they 're from and never come back .,1
30770518_1,575695,1346,0,hate,I bet you can see the Mexic-ants from space with the Google Earth. photo ants on picnic table CYF salt of the earth,1
14088896_3,573561,1381,0,hate,I have been trying to find a job but the mexicans take everything we had .,1
30466436_1,735180,1388,0,hate,I know I keep hoping I wake up one day and this multiracial hell Canada was all just a terrible nightmare  but it never happens .,1
30406276_2,734886,1348,0,hate,Raising 1 healthy  racially aware child is worth more than all the libtard and mud children in the world .,1
14060188_1,575256,1383,0,hate,Probably especially if they are legitimate refugees from a war conflict  as opposed to the fake black and brown refugees that are flooding the country now .,1
31000153_2,576505,1346,0,hate,Jews are the most demanding and worst patients of all .,1
13462083_1,573169,1346,0,hate,The islamic disease is even more dangerous than the more obvious black or yellow disease .,1
13852694_3,573444,1391,0,hate,Cowardly scum from the Irish countryside bigging up in army jackets .,1
13590005_2,589951,1393,0,hate,Their lies are so thick and many that people do n't see the truth when it is in front of them !,1
13456922_2,578990,1347,0,hate,Lack of compassion seems to go hand and hand with lack the of White blood .,1
13942302_2,592355,1388,0,hate,Most of the time they are quiets sheep who want to intergrate but their children makes a new generations of thugs and prostitute .,1
14106678_1,599971,1381,0,hate,DuetschGirlTX No I live in a tiny ass town where i am only one of 100 white folks ( maybe less ) . near San Antonio. there are so many dirts around and they all stick together. so when it comes to a White Girl in this town i gotta have my own back ALWAYS Is that where you are ?,1
13589734_1,586668,1393,1,hate,Interesting article about what to do with these evil persons who keep telling the truth and who don ´ t want to surrender ( in Danish ),1
13393063_1,577328,1345,0,hate,I believe these apes may be on to something by chopping off penises to cure aids .,1
30398316_2,734674,1359,0,hate,I am not going to be beat down by a dyke  fag  or coon .,1
13454696_1,572084,1396,0,hate,I think it is a bit late to think to look after the safety and the future of white people in South africa .,1
30466480_1,735180,1388,0,hate,Do you have huge numbers of all the various turd to urine coloured rainbow of third worlders like many parts of Canada ?,1
14670747_1,576425,1371,2,hate,Yeah seems Negroes are too stupid or too arrogant to use an existing thread  so we see a new `` we be eguptshuns an sheet '' every week or so .,1
13596109_2,572043,1393,0,hate,But as for them adopting kids  the answer is NO .,1
13475873_1,575941,1346,0,hate,Don't eat a Snickers candy bar ... it will turn you into a negro ! ( Also has the obligatory White doofus guy at the end. ),1
14654023_1,614078,1371,0,hate,I have never seen an Asian woman dating an Asian man.They like the white man they re-force wiggers and our detrimental towards our cause.Cpamikei,1
13855833_2,577171,1391,7,hate,Perhaps the proud indigenous inhabitants of Dublin do n't want their culture ' enriching ' ( ruining ) with tripe like this .,1
31764382_1,750200,1363,1,hate,ya they are lazy drug-attics ... and they cant get a real job  all they do is deal drugs or they jump job to job to job ...,1
13287496_7,573474,1345,0,hate,String ' em up !,1
13547398_2,580757,1345,0,hate,Shows some interesting statistics about the jew rats ...,1
13456898_1,572496,1396,0,hate,I know exactly what you 're saying  I just hate to see those worthless apes benefit from the great things that whites do .,1
14672953_2,578919,1371,3,hate,Stop showing off South Asian functional illiteracy .,1
13854529_1,591076,1391,0,hate,that is absolutely * * * * ing unbelievable.they can just go route one now.no more messing about going through europe.in bongo land one minute jump on the plane and 5 hours later hop off the plane with the biggest negro smile and shout ASYLUM.i am totally depressed hearing this,1
13125624_1,577311,1345,0,hate,See South Africa is just a glimpe into OUR future  as the beasts of Memphis run it directly into the ground .,1
14678603_1,572073,1371,0,hate,I am White and I believe all White people know the difference between right and wrong no matter what they say about their political positions.We are facing genocide as a people and the infighting is just loved by non Whites .,1
13849898_1,591076,1391,0,hate,how the hell are they going to integrate into Irish society ? They come from a dirt poor medieval country and have spent the last 3 years living in a refugee camp.what skills are they going to bring here ?,1
30518085_1,734612,1348,0,hate,When I am around young people and rap music or negro culture comes up I make gestures implying the savagery of blacks .,1
30384063_1,574720,1354,1,hate,Thank you for posting this ! this disgusting lie will hopefully one day be addressed and corrected  at that point I would hope the world will see the Jews for what they really are .,1
31676530_2,575645,1345,0,hate,I 'd put him somewhere between the typical African and an ape .,1
13484565_1,581444,1345,2,hate,i've felt anger when i 've read it on forum  but we have to do our part and speaking at loud voice this fact  because  for example  i 'm from europe and this fact is not pased on tv news or in the news paper ... knows your enemies is the first pass for vicory on them !,1
31411361_3,576714,1346,0,hate,They dress like blacks  talk Ike them  act just as stupid .,1
14033722_2,572196,1387,0,hate,When the populations are not seperated racial mixing occurs and that is genocide .,1
14665878_2,572057,1371,0,hate,Why not just kick out all those Africans ?,1
12857372_1,572112,1346,1,hate,They need the white male distracted as much as possible and of course the glorification of the groid ; two birds one stone .,1
30546987_2,575717,1348,0,hate,With the liberal media and police departments under reporting black crime they have been given a pass on their ghetto ways so many times that it as becomes acceptable behavior for them as there is no real consequences for it .,1
14285789_1,572043,1380,0,hate,Hell I 'd rather clean a dozen tiolets a day then have to walk into a bathroom and see some mongrel standing there with a mop giving me a glassy-eyed stare .,1
13480119_1,577495,1345,0,hate,God it is sickening to see these young lives taken by feral negroes .,1
14025149_1,576601,1387,0,hate,Protesting Catholic guilt mongering and intellectual deprivation is as worthy of mentioning as the protesting of institutionalized and indoctrinated White guilt from the Jewlords across the Apelantic .,1
14413050_1,574116,1375,1,hate,Don't stop trying because the negro will prove you to be right .,1
30585978_1,577580,1362,0,hate,seven billion `` Humans '' on the planet and with Open borders  H1-b visas  fake social security numbers  colleges hiring foreign nationals over White Legal Americans  and Obama 's Amnesty on line with an apathetic public    well  dye your skin black and unlearn your english and you might get a good job .,1
13272432_2,579609,1345,0,hate,If it 's black  send it back .,1
30481181_2,735180,1388,0,hate,The Brown and Black filth are starting to creep into Orillia and Midland sadly .,1
14668651_1,576755,1371,0,hate,https://www.stormfront.org/forum/t1020784/ https : //www.stormfront.org/forum/t102 ... ghlight = sweden https : //www.stormfront.org/forum/t102 ... ghlight = sweden https : //www.stormfront.org/forum/t101 ... ghlight = sweden https : //www.stormfront.org/forum/t101 ... ghlight = sweden https : //www.stormfront.org/forum/t100 ... ghlight = sweden https : //www.stormfront.org/forum/t100 ... ghlight = sweden https : //www.stormfront.org/forum/t100 ... ghlight = sweden God save them .....,1
14655606_1,575683,1371,0,hate,I do n't know ... if afrocant 's do n't slather their skin several times a day with cocoa butter lotion it takes on a definite crocodilian appearance .,1
13843470_2,572109,1391,0,hate,So why are n't you complaining about the other mud races ?,1
13842545_1,591099,1391,0,hate,Im surprised C18 wasnt mentioned  they always are when the OB smash the EVIL neo = nazis Yellow press at its best,1
13849752_2,572187,1391,0,hate,Every action he 's taken reveals that he is completely unacceptable. as a citizen  in White societies All the blacks and browns can do is wreck and destroy - and that is all they have done  and do .,1
13845978_1,591076,1391,0,hate,oh dear isnt that terrible well i suppose they will just have to leave then and go somewhere they are more valued,1
14665164_2,575459,1371,0,hate,My Home Town is overran with spics and sec 8 coons at this junction .,1
14051888_1,572106,1383,1,hate,The worst thing about this is that every single one of our beautiful cities in ALL of our countries now look like this .,1
14658274_2,604689,1371,0,hate,Both Asians and whites are composed and calm and blacks seem to have no self control .,1
14663763_1,577225,1371,1,hate,if its such a big deal that you need to talk about it  yes. you are a non-white. you might as well be fully mongol .,1
13594369_2,586437,1393,2,hate,We have already taken too much that we do n't need any of those people on our soil .,1
30541960_1,738851,1348,0,hate,Their brains have never developed so they think there still in the wild jungles of Africa .,1
13552491_3,576755,1346,0,hate,Blacks and mexicans were represented thoroughly. do yourselves a favor  shoot your t.v. !,1
14106203_1,599920,1381,1,hate,Someone Please Tell me what can be done or which people to tell that the Mexicans and or other hispanics here are undercutting price quotes on Good working People .,1
13940778_1,594169,1388,0,hate,So sick of the way its working  I remember when I was growing up in Winnipeg the little shops were all white runned and owned and would hire people from the community and it was great it helped people and kept streets safe even though me and others would cause some bull * * * * it wasnt anything to how it is now .,1
13291133_1,573473,1345,0,hate,Not only is this case typical of the feral sub humans but it 's a perfect example for our people of how totally out of control they are and that they cannot be allowed to remain among us .,1
13609554_1,589705,1393,0,hate,It's people like this that are the face that represents the filth of Islam .,1
13503555_1,575787,1345,0,hate,SEX: MALE RACE : BLACK D.O.B : 08-24-1950 HEIGHT : 5 ' 11 WEIGHT : 180 EYE : BROWN HAIR BLACK In Custody For : 001 MISDEMEANOR COUNT OF CRIMINAL TRESPASS 2ND DEG This dude looks like an olde version of Cornielious from `` Planet of the Apes '' !,1
30560620_1,578431,1359,0,hate,Love how the ape loses so starts going on about how he 's going to shoot him .,1
13456820_1,572059,1347,0,hate,Put that fat Black idiot to work and she would n't be smirking at Whitey and playing stupid for the camera at her welfare review hearing !,1
14667042_2,572043,1371,0,hate,In fact  if you buy California fruit  you have tasted illegal alien DNA .,1
31736267_2,574558,1363,0,hate,I am a white female and I am proud of my race. and dating a black would be disgusting,1
14021695_2,580079,1388,0,hate,I noticed a lot of fat little white girls with monkey boyfriends .,1
13861502_1,592652,1391,1,hate,I would' nt even consider these knackers/pykies as Irish as they have no respect for their race or loyalty to Ireland and should be put down like the dogs they are .,1
13446777_1,575344,1347,1,hate,They're coming out of the woodwork to oppose white unity and White History Month .,1
13865550_1,572043,1391,1,hate,God only knows  these people have no respect for ANYTHING not even their own .,1
30550201_2,572314,1362,0,hate,It is also a breeding ground for Dieversity  and Libturd Indoctronation .,1
30729421_5,572259,1362,0,hate,Intellectual morons  or educated idiots  are good phrases to describe them .,1
13866393_1,592755,1391,0,hate,So now Stormfront Ireland is solely responsible for all racist attacks in Ireland. lol Ted is right this is the work of the Kikes those * * * * ers are never happy .,1
13621261_8,579371,1393,0,hate,We do n't need such scum .,1
30630736_2,576576,1354,1,hate,A puppet in the hands of the Jews were Zionist Jewish States of America and the Bolshevik Soviet Union .,1
30507680_3,603922,1362,0,hate,All we have is blacks and a few mestizos and all are pretty well behaved  we keep them that way around here,1
13164908_2,572144,1345,0,hate,Also I agree it 's not fair to monkeys to compare them to black people .,1
13480579_1,575102,1346,0,hate,just saw a hershey 's commercial on tv  ca n't find it on jewtube shows a White woman happily sharing candy with some mop headed groid male on an escalator guess I wo n't be buying that stuff ever again,1
31402537_4,572176,1346,0,hate,I would n't marry a asian even after cirurgy .,1
14432138_5,572825,1375,0,hate,Jewish Supremicism is at the end of its noose. : madex,1
14666375_3,573247,1371,0,hate,Their resistance to immigration is precisely because they have been exposed to you non-White vermin and your effect on their nations .,1
13401474_2,581236,1345,2,hate,I hope they all starve .,1
14013954_2,579104,1388,0,hate,Pakis are all about forcing their culture on us .,1
13503662_2,576356,1395,0,hate,I was so shocked to see all those blacks when i moved to Holland : S,1
13640369_2,591136,1391,0,hate,So even if it was shown n a bad light I would hope it would bring lots more new members as the time has come to show the non white races that we can only take so much before we raise up,1
14027524_2,594105,1387,0,hate,Sooner or later the black one will say `` mother * * * * er '' or `` madick '' .,1
31749734_1,572266,1363,0,hate,If they do n't find a way to kick out the brown cloud that 's already there the Danish gene pool is lost .,1
13858462_1,591104,1391,3,hate,One the Chinese get there teeth into a country that s it they take over .,1
30694638_2,607653,1348,0,hate,Why would I want to contribute to the Kneegrow and spic 's wellbeing ?,1
13455369_4,582378,1347,6,hate,WE GOT MONEY AROUND HERE TOO Compton Crips Pt.1 - YouTube These negroes are in the middle of the street  seems like something of a zoo  playing with their cheap lowriders .,1
31768385_1,572874,1363,0,hate,Wow maybe next time you should leave your little sister at home especially since you live in a highly non-white populated area .,1
14040305_1,596118,1387,0,hate,Its about time we as a nation take matters into our own hands  over throw the government stop the white genocide deport all immigrants and establish a government to help indigenous white Britons rebuild this country .,1
13600551_3,586508,1393,0,hate,Some of the things I noticed were shop tailors dummies that were black  a couple of mud restaurants  and the germ of blacks being `` fashionable '' taking root .,1
14412008_1,577363,1375,0,hate,The only species that constantly grabs his crotch in front of others and waves their arms around furiously are : 1. monkeys 2. blacks 3. both of the above Need I say more ?,1
13862513_1,591076,1391,0,hate,i am just down the road to you.welcome to the board.it breaks my heart every time i go to Galway city and see the amount of blacks there.the other week i was walking down shop street and there was a moslem standing in the street selling copies of the koran,1
14031187_3,572512,1387,0,hate,There are London areas that could be described as nothing less than little islamic republics .,1
12866622_1,577031,1346,0,hate,If your house door was locked  but at midnight your neighbor opened the door for some muslims to come inside and take your stuff  rape your wife and beat you nearly to death ... would you still think your neighbor was a nice guy ?,1
30745491_3,572083,1354,8,hate,When I die just put a monitor in my coffin running a never ending holocaust documentary  just to make sure I nevah fo-get !,1
14077746_1,575384,1383,0,hate,everyone who doesnt speak Romanian and look as in WHITE get out of Romania a move back to your homeland .,1
14677667_1,572070,1371,0,hate,To me it means that Jewish supremacists will never again allow Whites to have a say .,1
14062533_7,576775,1383,0,hate,Well Marco is a German patriot and musician who  in the sick minds of ZOG  committed the heinious crime of producing music for a local school .,1
30560311_1,578431,1359,0,hate,Honestly if they ever fired them I 'd expect they 'd do more damage to themselves since the average negro lacks the intellect for basic firearms training .,1
14297733_2,605744,1380,0,hate,Black and Asian immigrants who are coming in and those who were borne here and their breading patterns are the threat to our gene pool and not other white Europeans such as polish people .,1
14672029_1,614483,1371,1,hate,Not sure if this is the correct place i should post it  but a good video that just uploaded on youtube about these hypocrites .,1
14267446_8,581259,1380,0,hate,It then became a booming black town  and they ran it straight into the ground .,1
13481130_3,572154,1346,0,hate,- `` Something about black '' and the old favorite `` Once you go black you never go back '',1
14439584_1,605459,1375,0,hate,The kikes probably put the Leftist up to it  to make it seem like they do n't have total control of everyone .,1
14037645_2,595877,1387,0,hate,A good old bit of nostalgia from the days when there was hardly a blade of grass or a coon on the pitch .,1
13847476_1,592532,1391,0,hate,Everyone in Ireland has a duty to make life as difficult for blacks as possible if our children are too have any kind of future .,1
13598214_1,573840,1393,0,hate,As far as im concerned as soon as the little half breed is born  it should be tied round her neck and both mother and mulattoe should be flung in the nearest river.Lets see if daddy jumps in to save them !,1
13291528_2,573347,1345,1,hate,I have to help I WILL NOT see these animals go free !!,1
14034178_1,575082,1387,0,hate,All of the security guards i see are white but maybe  just maybe  i 'm blessed because no doubt these negro security guards abuse their power .,1
30541960_3,738851,1348,0,hate,The only thing that they care about is welfare and mooching of all the rest of us .,1
14677898_3,572043,1371,0,hate,Liberals will have you believe it is so they can blame Whitey but it 's all such a mixed hell hole  all that breeding with arabs ....,1
30439769_3,573224,1362,0,hate,It 's just the way they are .,1
13590627_2,586990,1393,0,hate,It does n't matter how you dress up a mud .,1
13843729_1,579630,1391,0,hate,What a load of crap.Water are ye people for real Ireland is been taken over by non Irish and this rubbish .,1
30560311_2,578431,1359,0,hate,I 'm surprised they 're not holding the gun back to front .,1
13291349_3,573432,1345,5,hate,They probably have a 150 I.Q. with all three of them combined .,1
31744072_3,599380,1363,0,hate,Any expressing of their homosexuality outside their home however must be stopped .,1
30626223_1,575946,1348,0,hate,I wonder what it 's going to be like if the Big Chimpout of 2014 really happens .,1
13506182_1,586372,1395,1,hate,Because the communist party was almost all jew out to kill any gentile that stood in their way or had property that the jew - communist wanted .,1
12861962_1,573285,1346,0,hate,I Can tell you right now if a black mob is threatening my life and burning my town I 'm going to start shooting .,1
14406890_3,575011,1375,0,hate,Teach our men to be men again and defend our countries and women folk against the non white .,1
14077688_1,578492,1383,1,hate,Yeah I think they 'd be much better off back home .,1
14080747_2,579408,1383,1,hate,They all need to be sent back to Afreka along with the Joos that control our politicians .,1
30733649_1,572291,1354,0,hate,The holocaust never existed except in the minds of the people who believed it .,1
13406897_3,579436,1345,0,hate,I 've seen negroes who look ( and undoubtedly act ) like him .,1
14417461_1,573188,1375,0,hate,Yeah I saw that news segment about the mixed race couple who lost their home because of the mudslide .,1
13861385_1,590493,1391,0,hate,the white race will soon be on the brink of being a minority in a few years if nothing is done to stop these vile hordes invading our lands  I for one do not want to live in a city like Bradford or Birmingham where we are outnumbered 2 to 1 or worse,1
13458375_2,579408,1347,0,hate,Those nogs in France do n't belong there and then they show how unruly they can be .,1
31750807_2,573685,1363,0,hate,Therefore they had to practice slavery before all other races .,1
31769461_1,589998,1363,0,hate,Fags are a big problem  they are recruiting our kids  in the schools that we pay for .,1
13503418_1,576356,1395,0,hate,Yes before age of 10 i never saw an negro in real life  when i moved to Holland i was horrified by the amount of non-whites .,1
12852431_1,576278,1346,0,hate,I feel so sorry for all you people living there  wish you could all move here hopefully you do n't suffer like your neighbours in zimbabwe .,1
32923728_2,575163,1345,0,hate,Those Jewish murderers of millions of Whites have been forgiven .,1
13028070_2,576106,1345,0,hate,What alternative do you have other than kill the black policeman and every black cop you can until they get you .,1
13864997_3,585781,1391,2,hate,Most White Western Women have the racial sense of a cabbage .,1
14029408_1,575451,1387,0,hate,We are far closer to being neanderthals than apes .,1
12850089_2,576026,1346,0,hate,I could n't imagine living in those conditions with drugs and filthy negros everywhere .,1
14662277_2,572134,1371,0,hate,Only in the mind of the INTERNATIONAL JEW could such an evil machination  with its ticker tape parade of lies  be cooked up !,1
14030512_1,577598,1387,0,hate,Migrants living in fear after racist bomb attack on Poles - Northern Ireland  Local & National - Belfasttelegraph.co.uk They 're threatening to leave  we 're doomed !!!,1
13061354_1,573432,1345,2,hate,They are too dung stupid to be able to tap into the market .,1
13059977_2,579198,1345,0,hate,Good going libtards  you ruined Rhodesia .,1
31767403_1,749891,1363,0,hate,I would just like to express how sick and tired I am of bi-racial half-breeds kids at school boasting about their `` unique heritages '' .,1
30565018_2,572842,1348,0,hate,What makes it suck are the Jews that run it and the Blacks that play in it .,1
12843325_1,572191,1396,0,hate,We have a little piece of legislation called the Prohibition of Foreign Military Assistance Act This prohibits mercs from operating in South Africa. on pain of five years of hell in a kaffer jail .,1
