file_id,user_id,subforum_id,num_contexts,label_text,sentence,label
14658248_1,572667,1371,0,hate,If half White non negro and Jew are Pro White and do n't reproduce then they are ok .,1
30471804_2,735180,1388,0,hate,The race traitors sicken me too .,1
12848217_14,575810,1346,0,hate,I also  unfortuantely  spent 7-8th grade in a 95 % monkey house .,1
13462130_2,572196,1346,0,hate,Maybe they will be resettled deliberately as refugees or maybe they will come for the women like the chinese men are doing .,1
14672861_1,572043,1371,0,hate,Deport all Indians back to India and make them pay for the trip .,1
13126067_2,578146,1345,0,hate,Always nice to see a negro on the receiving end of a beat down from a white for a change .,1
30603370_1,572194,1359,0,hate,Arab militaries are incompetent .,1
14095559_2,598744,1381,1,hate,I do n't know if the person that said that ever leaves the house  but all I ever see are black guys and Mexicans everywhere .,1
13603439_2,586425,1393,0,hate,Ethnic crime never ends it seems .,1
13499896_2,576220,1395,0,hate,Every f * cking school child knows that the Globe is round  only total PIZDAS do n't .,1
14073622_2,581367,1383,0,hate,Too many libtards  I would n't waste my time there .,1
31723707_3,750045,1363,0,hate,There is only about 10 black kids in our school and 300 f' n spics. its my senior year and i really cant stand all this anymore. i know there are lots of others on this board that feel the same  but i need some support !,1
30679934_1,606437,1362,0,hate,the kind of perversion that leads to homosexuality also leads to pedophilia. why take the risk  and even if the homosexuals turned out not to be pedophiles why would anyone want a child to live with two perverts .,1
31706302_9,586694,1363,0,hate,Do n't come down too hard and alienate him  just keep a light hearted attitude and let him know that you find his actions disgusting .,1
30404456_1,577669,1388,0,hate,Nearly everything if not all acts that the liberals carry out damage this nation and our people .,1
30712850_3,575645,1354,0,hate,If the Jews are allowed to decide for everyone the correct version of history  I 'm sure they 'll eventually re-write the history around Jesus Christ .,1
13139471_2,576241,1345,0,hate,ZOG is getting rid of every White-dominated area in the world .,1
14105196_1,599813,1381,0,hate,open a new shop somewhere get my son more interested in education ( he hates school ) help mor ein my community try to whiten things up > >,1
14411050_2,587508,1375,0,hate,Imagine the groids licking their big lips when they see all those unsuspecting tourists walking around .,1
14667441_2,578188,1371,0,hate,Nothing has ever been as harmful to society as jews  their savage beasts  and their thoughtless gimmiegrunts .,1
14298184_3,605752,1380,0,hate,It is hate if we disagree with this ethnic scum and no hate crime if they attack us .,1
14052954_1,576306,1383,0,hate,^ You ca n't make this stuff up Go have a drink  drown the sorrow of living among primitive Asians .,1
14084694_2,573460,1383,0,hate,I got sloppy seconds after some Muslims used this girl .,1
33661937_1,734626,1388,0,hate,I would move too but unfortunately there is nowhere that is untainted .,1
14676826_1,572070,1371,0,hate,Here is your logic : some whites are corrupt whores for Jewish supremacists  therefore Whites should not oppose Jewish supremacist extermination of all Whites and JS efforts to control humanity 's future .,1
14412910_1,584738,1375,0,hate,All of this diversity crap needs to stop soon whites will be extinct and I 'm not living in a brown world I want a clean white world,1
13846211_1,587539,1391,0,hate,If that Nigerian bitch thinks she will be elected in Tallaght  she is in for a rude awakening .,1
12856276_1,573125,1346,0,hate,As usual the magic negro opens his mouth and lies pour forth .,1
14023144_1,573375,1387,0,hate,You can stop this by getting a dead pig and bury it underground where the mosque will be built .,1
13484158_2,579086,1345,1,hate,Who the hell cares if its not kosher ...,1
14031868_2,579639,1387,0,hate,The chairman of the FA is one David Bernstein and  yes  he is a member of a certain tribe that delight in bringing diversity and the benefits of multi-culturalism and ' anti-racism '  along with boatloads of third-worlders to Britain .,1
30613252_1,572842,1359,0,hate,I would love to see a video of Somalis blown apart with a torpedo and see bodies and scrap metal fly hundreds of feet into the air .,1
31752052_2,626679,1363,0,hate,The whites and the asians evoluated  and the blacks are still behind .,1
30954921_2,572067,1346,0,hate,I seriously hope she dies in a fire one day .,1
13163736_2,580130,1345,0,hate,We spent our time trying to get our Negroes to learn how to read .,1
30474323_6,581520,1354,0,hate,Then again  in this modern age of white youth emulating negroes and white adults groveling at the feet of the juden  perhaps it 's an appropriate word after all .,1
30480938_1,735180,1388,0,hate,We need to deport all nonwhites immediately  that or stop letting more in and sterilize the ones here  that will fix the problem .,1
31722565_2,577462,1363,0,hate,God forbid anyone should promote straight racially loyal hetrosexuality Diablo,1
14013954_1,579104,1388,0,hate,Seriously Canada would have been better off if they left the pakis at home  im like you I do n't object to asians because they at least try to fit in .,1
30389836_3,572367,1388,0,hate,I guess the Yonge St retail district will be smashed and looted .,1
14021558_1,574578,1388,0,hate,I try and avoid shops owned by.or employing non.whites too .,1
14670891_4,572134,1371,4,hate,Swim back to Liberia--with a jew under each arm !,1
13590627_3,586990,1393,0,hate,A mud is a mud is a mud that 's all there is to it .,1
31730733_1,611782,1363,1,hate,We should start gangs of our own and kill them and rob their homes  is this what the liberals wanted as `` diversity ? '',1
30406359_1,734576,1348,0,hate,there was this gay negro i was forced to work with on my first job out of high school here in sunny florida .,1
30500254_11,575946,1362,0,hate,One time she came in crying telling me that pavement ape `` hit me in the tummy '' .,1
14675832_3,576526,1371,0,hate,If you look at an Alaskan malamute and a timber wolf that are two different species  they look a lot more alike than say a Congolese and a Swede .,1
13488763_1,580930,1395,0,hate,ok so do we need to kill them too or are the slavs okay ? for some reason whenever i hear the word slav  the word slobber comes to mind and i picture a slobbering half breed creature like the humpback of notre dame or Igor haha,1
30626671_2,597102,1354,0,hate,So they can get reparations for their great grand parents ' `` suffering '' plus more .,1
13847110_1,591119,1391,2,hate,Is that overweight fat useless bitch blind ?,1
30680055_3,603683,1362,5,hate,Hell to have a teacher like this .,1
14660756_1,573285,1371,0,hate,Your both our enemies plain and simple  jews try to destroy us with their immigration and the jew would not be able to get as far as they did if many of them did not look white .,1
13481903_3,576661,1346,0,hate,Do you notice how the primate 's  I mean black kid 's arm is around the white girl ?,1
13061184_1,577495,1345,1,hate,I suppose the concept of a male cow and a female cow producing MORE cows  and the repeating process is too much for them to understand .,1
14653484_1,598307,1371,1,hate,Because they a vile plague on all of mankind that no one really likes .,1
13443527_1,581855,1347,0,hate,Allow me to apologize for my last post  as I was drinking heavily last night but you callin me a genetic lottery winner ? come on now I 've had my fair share of hard times just last week a yellow person came into my place of work and started making trouble .,1
13488914_1,575554,1395,0,hate,Why do n't White Europeans and Americans grow a set of balls  and deport these Black and brown animals from their countries ?,1
14032740_2,574284,1387,0,hate,Well  the warm weather is coming in and guess what  I now have to painstakingly endure all the offspring of these immigrants  Africans  foeigners ( Im putting them all because there is that many of them ) all playing out the front of the flats in the small garden area  screeching and shouting and their hyena pitched laughing .,1
14651924_10,572170,1371,0,hate,In reality they have no money and it is all a charade .,1
14670222_1,614078,1371,0,hate,Gay marriage has no place in any society  regardless of your race and culture.It destroys  morals  values  and the future of your offspring that will keep your race and culture alive.Regardless of your race and culture  homosexuality and gay marriage is the genocide of mankind .,1
14028967_1,577598,1387,0,hate,The Official Website of the British People 's Party A few unpleasant truths re. the zionist ass lickers of the DUP,1
14407209_1,572212,1375,0,hate,Most white girls are taught and brainwashed to love black guys  only way is to properly educate them and show them what savages they truly are .,1
13287496_6,573474,1345,0,hate,That 's every groid 's wish anyways .,1
14098906_2,580975,1381,0,hate,Of course  they are more virile than us  so that would n't happen would it ?!!!,1
14674224_1,577613,1371,0,hate,The Black race is yet to invent any kind of civilization .,1
30739072_4,572226,1362,0,hate,As Hispanic and Negro populations increase test score averages will decrease .,1
14416271_1,577234,1375,0,hate,Last Friday an associate here handed out 100 NV leaflets at a rodeo depicting a graphic summation of non-white ( mestizo ) immigration .,1
14062890_1,597491,1383,0,hate,Hi everyone .... I 'm from Slovenia and I utterly hate every living muslim in this world ....... and I despise even the dead ones,1
33045544_1,573473,1347,0,hate,Jews are not only insane  they are of literal demonic DNA .,1
13468636_1,582394,1346,0,hate,The jew media likes to prop this whites becoming the minority non sense up because they want to try and scare whitey  the media plays on the fears that the average retard thinks hispanic or latino is a race and they play word play with titles like white hispanic and white non hispanic it is all a magic show nothing more .. But Whites becoming a minority in Europe the homeland is a much more serious issue that concerns me greatly .,1
30420875_3,572790,1388,0,hate,It really pisses of the liberal leftist,1
31787508_2,599694,1363,0,hate,I think this would just be a tighter grip the ZOG would have on us .,1
14675003_3,572073,1371,1,hate,You either stand with your people or they will stand over your dead body .,1
30630061_1,739937,1348,0,hate,New York 's Old Pennsylvania Station  What a tragic loss  to promote Jewish `` Modern '' filth  no surprise !,1
14664974_2,614322,1371,0,hate,About the Chinese  those who remain in their own country are good  those who become illegal immigrants in white nations are bad .,1
30954922_2,572228,1346,0,hate,JAPs are a total hoot  each the center of the universe  loud  brash  vain  arrogant . . .,1
30580366_3,734616,1348,0,hate,Every cultured society and all things therein were created by whites .,1
30742787_1,576578,1362,0,hate,I'm not really surprised - now going to college with blacks I can tell you they continue to behave in such a manner even in higher education .,1
30392180_9,573148,1362,0,hate,No Jew has ever found a way to force a big black females to parrot Marxist propaganda the way that little dumb liberal anti-whites will .,1
13165044_2,576954,1345,0,hate,What typical brainwashed liberal lemming .,1
13467182_1,581367,1346,0,hate,When I was last time in South Africa  we went to Sun City and saw little black monkey children swimming  funniest thing was watching drying water off their faces  it looks exactly like baboon or something  way they do it  whites have certain mannerisms with doing things  they have completely ape-like ones .,1
14015131_1,578856,1388,1,hate,Seems like you cant get away from these parasites anymore its happening and getting worse everywhere .,1
13450155_1,581678,1347,0,hate,the entire system of classes are a marxist invention. the judeo-bolsheviks are using this to divide our society. in other words ' Divide et impera ' .,1
14014876_1,572269,1388,0,hate,One reason we moved out of our ( at one time 99 % white ) neighborhood was because massive numbers of Chinese moved in and i swear to you a literal rotten smell came with them .,1
31706302_2,586694,1363,0,hate,Do n't sit around and argue with them  just act like they are pathetic ( which they are ) and try to shame them .,1
30677210_2,578188,1348,0,hate,Mexicans are real prone to diabetes and I want to help them get to Hell as soon as possible .,1
12834922_2,572429,1396,0,hate,God knows what would come out of Africa if only blacks could come up with investigative journalism .,1
14297417_1,591982,1380,0,hate,Can someone help me find an ol ' comrade of mine who 's now rotting in a California Prison for his next two lives for allegedly victimizing anti-racist scum ?,1
13857839_2,572142,1391,0,hate,Blacks have shown as they are able to survive all year round sitting on their arse waiting for comic relief .,1
13477084_2,572059,1346,2,hate,I have a dream - one of these days Black occupation of America will be history !,1
13383878_1,573600,1345,0,hate,Wasn't it the Government in the Congo that was at war with the gorillas a while back because the gorillas were `` threatening their superiority '' ?,1
13398095_1,581200,1345,2,hate,And this is why SA went from First World under Botha 's rule ( deKlerk does n't count ) to a Third World begger horde .,1
14657070_2,575459,1371,0,hate,You are the loyal punk to dead men that would underbid your labor with slaves of the negro race .,1
13467365_2,574141,1346,0,hate,I do like the outfit they dressed the simian in ; he looks so regal,1
12858929_2,572226,1346,0,hate,Do non Whites really think they measure up to Whites ?,1
14668408_2,577788,1371,2,hate,If it means exterminating the blacks in Africa so the gorillas have a healthy  big nature preserve I do n't oppose it .,1
30630731_5,575161,1354,1,hate,When I watch things like this I pray God will have vengeance on these sub humans even if they have asked for forgiveness .,1
14671055_2,572816,1371,0,hate,Racism is as old as time itself  and no one ever admired a groid for anything other than cheap dumb labour .,1
13864550_1,577819,1391,1,hate,Boy those same blacks get awful mad when you have a sign saying `` No to a black Africa ''  then it becomes wrong .,1
14296090_2,573600,1380,0,hate,Why would they let blacks live ?,1
13858917_1,591104,1391,0,hate,I now only go into the city when i have to and i had to yesterday and I could not belive what has happend in there .I think i must have seen every peice of dirt from every corner of the globe in there it was horrible .,1
13602525_1,585974,1393,0,hate,Well the entire world is being brain-washed by Judeo-American films  today everyone has a Jew in every corner of your house .,1
13474668_1,572224,1346,0,hate,But unfortunately  Maine 's become the dumping ground for Somalis and other African trash .,1
13844825_1,581500,1391,1,hate,They do it because they know it pisses the whites off  by showing disrespect as such for other people shows they have no respect for themselves .,1
13220540_1,573265,1345,0,hate,The filthy ape gave the horse an infection .,1
13504803_2,586601,1395,0,hate,Situation in Switzerland is terrible  blacks and muslims are everywhere ! We were a great Country with a great People but all these monkeys are transforming Switzerland in a zoo where law is not respected .,1
30742787_2,576578,1362,0,hate,They always think they are somehow exempt from the rules,1
14415147_1,611942,1375,0,hate,Hey guys please go here to help us send the Mexicans back to Mexico .,1
13299159_2,579220,1345,2,hate,I hope I see the day when thease worthless pieces of crap are OUT OF HERE .,1
31766409_2,581194,1363,0,hate,The only bad thing is that these sick animals will infect whites .,1
14669166_2,573256,1371,0,hate,The problem is in blacks ' heads  but hey  you have already known that .,1
14074039_1,579750,1383,0,hate,I stumbled n this by accident Absolute savages and yet you will have all the liberal women saying how great multiculturalism is and we are all the same Le TÃ © lÃ © gramme - France - Montpellier ( 34 ) .,1
30603583_2,578431,1359,0,hate,That ape tried to gang up a lone white .,1
13473247_5,583605,1346,0,hate,Soon in their minds it is ok to date them and have children with them thus polluting our great race and pushing us further toward extinction .,1
30500254_14,575946,1362,0,hate,It 's annoying to live in a time where a subhuman monkey coon thinks it 's okay to hit an Aryan white blond  blue-eyed child .,1
14024960_2,595714,1387,0,hate,Did they put that Groid 15 next to Rooney just to make Rooney look at least half-human ?,1
31731815_1,599324,1363,0,hate,I find it funny that blacks find their own women disgusting  but i find it even more disgusting that because of this they go after white women  and are usually successful  its good to see a white girl tell one off .,1
13456820_2,572059,1347,0,hate,Better yet  make her the poster child for Black Resettlement ! Spending her days digging for grub worm dinners would actually be good for her .,1
13478512_3,576192,1346,0,hate,The ugly black will always be .... black !,1
30712850_5,575645,1354,0,hate,( The Jews had the Romans murder Jesus for them by falsely accusing Jesus and by turning down a chance to pardon Jesus .,1
30451625_6,577167,1388,0,hate,And it stunk like refer and black sweat .,1
13385655_1,572127,1345,0,hate,The doctors of ju-ju and voodoo seem to have left their mud huts and moved into office buildings built by White people in cities built by White people .,1
13944391_2,581731,1388,0,hate,Most if not all of the whites at my school are complete race traitors,1
13419558_2,575899,1347,0,hate,They do what they always do take something of someone else 's and make it their own .,1
13843422_1,592421,1391,0,hate,unless you are a tourist or here the study for a year or two please just go back Russian  we dont need or want more slavs,1
13458183_1,582330,1347,1,hate,More impulsive Negro stripping ...,1
30654383_2,572231,1354,0,hate,Egyptian TV Host : The Jews Are Using the Holocaust to Suck the Blood of the Germans - YouTube,1
30582398_1,572999,1359,4,hate,No I hope the negro is not all right  ever .,1
13472478_1,572112,1346,0,hate,I was really worried about this one because I thought a bunch of groids were going to hop out of the cars signifying the town to get so excited and the women to remove clothing ....,1
13332658_1,579513,1345,2,hate,Let mother nature evolve these people naturally because no amount of money or aid is going to drag these ' things ' into the civilized world where they serve absolutely no purpose .,1
12858788_3,576152,1346,4,hate,Liberal is just the PC word for Rapist .,1
30607361_1,581584,1348,0,hate,Back when I was a kid  even the black folks called them that .... `` Ooohhh I' z cai n't wait until Crimusz  I' z gonna get me sum of dem niggah-toes and oranguz fo ' Crimusz  an ' sum peppahmintz ; dey shoa iz gud ! '',1
30534328_2,576359,1354,0,hate,Lying Marxists !,1
14414465_3,573600,1375,0,hate,http://www.abc25.com/Global/story.asp ? S = 5352185 Non whites commit far more crimes against whites each year but its never considered a hate crime and alot of them never spend any time in jail !,1
31757365_2,577462,1363,0,hate,So it looks like the Blacks have lost even that one LOL Diablo,1
31041845_1,573538,1346,0,hate,The jews represent everything vile  deviant and unnatural  everything and anything that is an abomination to our Lord Jesus Christ  I hope he is burning with his father in hell .,1
14283266_1,584350,1380,0,hate,If you had your way their would be no whites to pay taxes so the blacks could collect welfare and as they have proved in Africa they are incapable of feeding themselves,1
13588153_1,589562,1393,0,hate,If you think that 's funny  you should have seen the black guy that used to run around my home town wearing a kkk emblem.But people like that are usualy not that bright .,1
30451625_3,577167,1388,0,hate,I went back a cpl years ago and the black vermin were everywhere .,1
13471818_3,576319,1346,5,hate,Hispanics  Blacks and Asians are all doing it .,1
14039567_2,577432,1387,0,hate,Hopefully the traitors will be encircled in Westminster palace .,1
13474456_1,576695,1346,0,hate,zpridez NO big deal  I got your drift.IMO If these bellyaching Black peoples et al continue to negate/or ignore the present ' Products of Progress ' within society we 're all doomed .,1
14667444_1,575082,1371,0,hate,Those in the countries you mentioned are the mongrel offspring between whites ( Aryans ) and Arabs and its funny how those of the East who claim to be the Aryans talk about white people who came and mixed with them and the only Aryans apparently in the East are those with light skin and blue eyes .,1
13596651_2,589152,1393,0,hate,They ca n't survive without us  but they do us nothing but harm .,1
13443527_2,581855,1347,0,hate,This is ARKANSAS they have no right to smell up my place with their chinese restaurant BO ~ ▲ RESTORE ORDER ▲ ~,1
14030948_1,596255,1387,0,hate,Having recently traveled to London I was disgusted by how non-white the city had become .,1
30546994_1,573410,1348,1,hate,Because they are essentially child-like and until someone steps up and says something they will just carry on  again like children .,1
14074356_1,581901,1383,1,hate,That's vile  but I ca n't say it 's a big shock  their culture seems to glorify that sort of behaviour ...,1
30395864_1,734604,1348,0,hate,Right now when I think of WASP 's  I think of New England liberals who have never had a taste of diversity in their life .,1
13406897_2,579436,1345,0,hate,He walks upright  and has human arms and legs .,1
13451537_1,572668,1347,0,hate,We can work together and look after each other which blacks cant. We can think as individuals and do things because they are right and not because we are told to  which asians cant.,1
30627161_1,572339,1359,0,hate,If monkeys are on my property i call animal control and defend my family and property with whatever means possible  simply talking sense to a monkey and pointing at it will not stop it from misbehaving !,1
14274155_1,598711,1380,0,hate,There will be hundreds of thousands of white people fleeing your proverbial sea of mud this is where we come in .,1
12856759_1,572087,1346,0,hate,Great image of the Jew as a poisonous mushroom .,1
14073953_1,579933,1383,0,hate,I am not Ukrainian but the Ukraine nationalists and right wing should understand that our white race in all nations in Europe North America Australia and South Africa along with any other white nations should support each other and join together against the Marxist multiculturistic agenda that 's invading every white nation and start to over through the powers to be that is responsible for this genocide and start considering deportation of non whites in white nations !,1
13481672_2,584956,1345,0,hate,If they were jew pieces of garbage who the hell cares what happened to them .,1
12960799_4,575076,1345,0,hate,May the wigger sister and parents be haunted by her death for the rest of their lives as it is in effect by their hands and actions that their sister and daughter was murdered by this beast .,1
30682994_1,574052,1348,1,hate,This is the argument homosexuals use to justify their behavior  that because there are no `` red letters '' about it  then homosexuality is not a bad thing .,1
30542077_3,573472,1348,0,hate,Get over watching monkeys throw a ball around and get a real hobby for God 's sake .,1
30626671_1,597102,1354,0,hate,I bet they 'll find a way to invent a new hoax .,1
30632889_2,577549,1362,0,hate,The anti-whites have been using education for decades to brainwash Whites against their own race .,1
30535761_1,580712,1359,0,hate,You have to defend yourself with riots happening across the country and invaders flooding across our borders .,1
30658705_1,572310,1354,0,hate,So the Jews are Gods chosen people and we are the dumb cattle used to bring the Jews back to Gods fold .,1
13502945_1,586345,1395,0,hate,i hope our patriots will throu eggs at them and will say some thing like get out to the jungle or i think our coach will make them to go to the trainnig at minus - 30C or - 50F that they uuuu will never be able to play agane and will fly to africa after first tranning 2508,1
13484572_3,576885,1346,0,hate,Anybody with half a brain knows that 's it 's BS and how Negroes have n't done anything for the development of any society  let alone Europe .,1
13455369_1,582378,1347,6,hate,Crippin nigga .,1
13379594_3,574041,1345,1,hate,Why should we try to civilize that which cannot be domesticated or civil ?,1
14409759_1,575247,1375,0,hate,Three more posters ready - these are definitely anti-race-mixing !,1
30383231_1,734672,1348,0,hate,Damn affirmative action they got the white house  now our beer halls  their is only one safe place left ... God 's save Iceland .,1
31735108_1,577415,1363,0,hate,I guess I got lucky  I we n't to a public high school and we never had to learn about the holohoax .,1
13480997_2,573561,1345,0,hate,Separation is the only answer !,1
30677075_3,575083,1347,0,hate,They only know how to destory our civilization .,1
30593186_1,576106,1359,0,hate,Ya and they kind of missed the fact that he is going to inner city schools teaching the monkeys how to better kick your white butt !,1
30570257_1,574483,1354,0,hate,Look what happens when Whites leave black Countries alone to do what they do naturally The blacks in White Countries today should be on their knees thanking Whites for trying to civilize them,1
13463975_1,572043,1346,0,hate,The biggest problem is new york.There are blacks all over the streets  when you 're in new york think you 're in nigeria .,1
