file_id,user_id,subforum_id,num_contexts,label_text,sentence,label
13454399_2,572059,1347,0,hate,With Black girls it takes a baseball bat - who carries a mu-ff' in baseball bat on a date ??,1
30677075_2,575083,1347,0,hate,They laugh at whites who obey the law  bother to get married  women who are chaste .,1
14417461_3,573188,1375,0,hate,Maybe God was punishing them for their interracial marriage .,1
13458375_3,579408,1347,0,hate,Send them all to Afreaka And sink the farkin boat !,1
30447521_3,576342,1362,3,hate,- White GeNOcide Project,1
14673719_1,575882,1371,0,hate,Would black people rather take one million dollars to move themselves and their immediate family back to the motherland  or stay here in America and blame whites for their poverty and crime ?,1
30457422_1,572269,1388,0,hate,And then there 's Asiacourt  the once beautiful  safe  WHITE  area of Scarborough ... ( and the last i checked ) was a garbage infested Chinease outpost .,1
14652674_1,572337,1371,0,hate,Indeed now they just need to feed themselves  educate themselves  police themselves ad nauseum ......,1
14409149_2,580348,1375,0,hate,White town saved by the magic negroes of Afreakkaland .,1
30422907_2,602986,1354,3,hate,It is easier for other races to follow the herd but not Whites .,1
30481256_1,577037,1388,0,hate,Better some overly polite White guy offering to tell you about the word of Joseph Smith than some nignog car jacking you .,1
12849464_4,575975,1346,1,hate,And the sad thing is the white students at those schools will act like that too .,1
13456064_2,574116,1347,0,hate,I just cant stand to listen to negros sing and 30 sec. is all I could handle .,1
14102803_1,573589,1381,0,hate,id like kids eventually. but not now. as for your sterlization. that is great. there really is no use for ppl to produce kids if they are wackos. being a nutjob is herditary .,1
30954922_1,572228,1346,0,hate,I wish you luck  is it any wonder Jew males lust for our White women ?,1
13502430_2,579436,1395,2,hate,They 're probably as high-maintenance as one of those crappy old East German Trabants  though .,1
12860642_2,572479,1346,2,hate,This was a bad move by the Jew puppets .,1
30767756_3,572648,1354,3,hate,I guess I would be destined for the gas chambers .,1
13468931_1,583169,1346,1,hate,All i have to say is none of this crap that is happening in the world is going to change unless people on a large scale actually stand up and say no we have had enough and drag the scum in the streets and deal with them in a most violent way .,1
30626672_2,573125,1354,0,hate,There will always be survivors  the juden will never let go of the holahoax,1
14023644_1,572921,1387,0,hate,It only took Labour ten years to bring more immigrants * cough * invaders  here than had ever migrated here in the last 5 thousand years .,1
30733649_2,572291,1354,1,hate,Therefore everyone in this thread is a holocaust survivor .,1
14670038_1,573247,1371,0,hate,I did n't realize we were offending you by pointing out how often Asians and Jews get surgery to look more White .,1
30754357_1,576340,1354,1,hate,`Interesting' to see someone of the same radio outfit to praise this figure  while there was an amazing show dedicated to uncovering the facts regarding this anti-German filth .,1
13853553_2,592575,1391,0,hate,Ireland does n't need arab scum like these .,1
13501379_2,586486,1395,0,hate,There are really few Jews and millions of those bastards on the body of our country .,1
13477832_3,573347,1345,0,hate,When ever I see these white children murdered by these sub humans it makes me so angry I could cry .,1
31723718_1,589856,1363,2,hate,You are white and you are better then them and the next time they harass you and someone else form a group of buddies and go up to the proncipal office .,1
13851745_1,588263,1391,0,hate,immigrants are desperate to stay here. who can blame them ? our government treats them as lords and we as muck. welcome to SFI Pluirin !,1
13850034_2,592500,1391,0,hate,It 'll be a welcome change to see a fellow WN from seeing hundreds of lefty bastards going to see RATM .,1
14670146_1,614439,1371,0,hate,It is important for people to realize that gays want gay marriage ..... not because they desire some sort of government paperwork  but because they are seeking the right to adopt defenseless children .,1
14080170_1,577768,1383,1,hate,It is an extremely cruel act against the poor Vodka-bottle forcing it to spend it 's time forever close to a jew .,1
14411259_1,587961,1375,0,hate,Charlton Heston is rolling over in his grave knowing an ape has been elected to the white house .,1
30837533_1,572087,1346,0,hate,A Kosher slaughter  blessed by every Rabbi under the sun .,1
13504803_9,586601,1395,0,hate,I had the luck ( ... ) to meet some africans in the past and I promise you that black are the worse cancer of the world  they 're ready to sell their own sister so you can imagine what will they do with our Countries ..,1
13458187_2,582515,1347,2,hate,Most of these videos belong on the Animal Planet tv channel .,1
12959685_1,577004,1345,0,hate,Yep the bottom line is without a strong family behind her a young girl is very vulnerable .. The Jew knows this and Glamorises the Negro using its media power  here we see the results .,1
30428427_1,734569,1348,0,hate,Check out this youtube channel i found  i agree with most of what he says Diversity DESTROYS Social Cohesion in the West - YouTube,1
30392062_1,735389,1362,0,hate,White kids need to interact with kneegrows and other non white kids or they 'll be lost in the real come the time they leave home ...,1
13842818_2,591162,1391,3,hate,If we do n't act soon they will bread us out .,1
13642136_2,591160,1391,0,hate,Piece of * * * * deserves to be shot .,1
14023352_1,572037,1387,0,hate,put the kids in a ophanage and arrest the whore of a mother to a point of not having more biracial kids 8 kids have to suffer all their lives to due a whore,1
30429635_1,578247,1354,0,hate,When asked how I knew the holocaust was a lie my answer was if it was the truth there would be no laws against saying it was a lie .,1
14088263_1,577767,1381,0,hate,...mating with other mulattos would be ideal  but since there are n't huge numbers of mulatto children compared to those of Whites or blacks I 'd rather see them up with blacks so that White bloodlines stay intact .,1
13449604_1,572896,1347,0,hate,because they deserve at least a taste of it for helping the white liberals and Jews push it on us I do n't think we should allow it to destroy them though .,1
12855154_1,576372,1346,0,hate,Their gods often had pale skin and blue eyes but I suppose literacy is n't valued highly by their cultural intelligencia .,1
14274155_2,598711,1380,1,hate,We are looking into building `` mud free zones '' by way of taking over key locations and building a refuge for our racial kindred .,1
14678021_1,572231,1371,0,hate,Watch the video  its only 10 minutes  you will see that eventually the bi-racial minority is butchered .,1
13250505_1,575766,1345,0,hate,As I commented a few days ago on this thread  massive race ( or ethnic ) mixing tends to preceed massive race ( or ethnic ) war .,1
30745654_1,575980,1354,1,hate,This might take the cake of the biggest load of bullsh ! t the Jews have tried to pass by the goyim .,1
13058178_1,578203,1345,0,hate,And these words of wisdom come from a man that thinks another mans anus as well as his own was made to be used as a vagina :,1
13117052_1,572234,1345,5,hate,The media wants to bury the story because they care more about homo killers not getting their sick fetish for young boys fufilled .,1
12854968_2,575569,1346,0,hate,My wife had to spend time at the UP Hospital in Philadelphia - thank God I was licensed to carry in Pa. Downtown Philadelphia is becoming a cesspool .,1
13589608_2,586693,1393,0,hate,Beautiful Sweden poisoned by Arab/Muslim trash .,1
14071005_1,572097,1383,0,hate,Like it or not  and I certainly do n't  but Ireland  especially NI is littered with memorials to  and even statues of  red terrorists .,1
13503506_1,586345,1395,0,hate,thats good there they was cleaning the moscow the same way like the capital i with thay would clean here this banana republic ( Washington DC ) send all this blacks and welffare resipiance to the mexico or at list Detroid 2056,1
30618051_1,739787,1359,0,hate,If you want to see what having a black  kenyan White-hating muslime in the Whitehouse has created  go look at Tarantino 's latest flick Django Unchained .,1
14034375_1,595808,1387,0,hate,the black security guards are racist and look evil and are always giving dirty looks to white customers especially polish customers !,1
12860462_4,572067,1346,0,hate,They all deserve an ass kicking .,1
30670272_1,575127,1362,2,hate,Dude stink bomb this event  when it gets dark  chuck a bunch of them on the floor  different spots  when the chimps start jiving and grooving  they will step on them .,1
13844126_1,592479,1391,0,hate,I hate the word racist it makes people being called racist think that they are doing something wrong when they the immigrants coming here are doing something wrong,1
14671829_8,573247,1371,5,hate,Tell them we 'll legalize drugs and pedophilia .,1
13164902_3,576137,1345,0,hate,I hope this little groid tortures her .,1
30384167_3,575992,1354,0,hate,This jew idiot is spewing nothing but propaganda .,1
30468360_4,579340,1354,0,hate,You weather the zionist storm well  my brother .,1
13856045_1,574043,1391,2,hate,The problems start when you start to accommonadate these people in the first place !  give an inch and they 'll take a mile ......,1
30545472_2,575397,1388,0,hate,And they will flood into all white countries as much as they can !,1
13476970_3,572196,1346,0,hate,Well I wonder if its started messing with the daughter yet .,1
14023149_1,574612,1387,0,hate,Yeah they are buying a lot of houses around my area to probz so they can house there massive inbred family when they come over to the UK .,1
14039896_1,578507,1387,3,hate,Yeah we could do with the same amount of black rapists as the Nordic countries are privileged enough to have .,1
14078237_1,581367,1383,0,hate,If this stupid brown savages would stop slaughtering animals or worshipping them ( like they do in India )  maybe they would n't be starving and so poor .,1
30658687_1,735191,1354,1,hate,This is the same race that thinks raping babies cures AIDS .,1
14290356_1,581139,1380,0,hate,I for one plan to hang the last jew with the guts of the last capitalist .,1
13475861_1,574312,1345,0,hate,i love it when jews get a taste of thier own vile medicene I hope each and every one of them young to old starve in the cold,1
14670891_2,572134,1371,4,hate,High time they get back to mother Affika and fix that mess .,1
13587085_1,572043,1393,0,hate,We've had a couple of similar cases in Finland  when a nig purposefully tried to give dozens of Finnish women hiv/aids .,1
14018972_4,574578,1388,0,hate,I am reminded of a quote I heard from a fellow white nationalist said that you do not clean up a pile of * * * * while being in the middle of it .,1
30457462_2,575397,1388,0,hate,HIV/AIDS is n't killing them off fast enough .,1
13443966_2,578935,1347,0,hate,And it ai n't your daddy 's New World Order either  more like a Jew World Order .,1
14038941_2,580185,1387,0,hate,That 's it I slag off anyone who did n't vote BNP or NF .,1
14419990_1,572711,1375,0,hate,The Jewish race is without any doubt the greatest threat to the survival of the White race .,1
13465908_1,572896,1346,0,hate,France has been gone for a long time  we will have to retake it later because there will be no French people in not too long .,1
13855831_1,584865,1391,0,hate,another coon giving out about Ireland and as if her opinion counts being second generation London jamican only means her mother was a filthy immigrant who waited till she got off the banana boat to give birth to her litter,1
14112377_2,599942,1381,0,hate,I guess they would not want to offend an ape .,1
13269862_1,572208,1345,0,hate,As soon as i found out she was with child by a mulatto and she 's a wet back too  I suddenly found her to be repulsive and shall never watch anything she is in again .,1
14031239_1,596278,1387,0,hate,You will know it is a nightmare on day you wake up and you have a black muslim running your country .,1
30750298_2,572033,1354,11,hate,Holocaust has no business in there .,1
14405792_1,575517,1375,0,hate,Latest reported attack on students by the local Negroes was on a couple out getting a pizza in the late evening hours  4 Blacks jumped them on their walk home .,1
13061423_5,573125,1345,0,hate,It is n't enough that we support mesico now we have to support africa .,1
14668181_1,573396,1371,1,hate,Yeah after losing peanut butter as their claim to fame  they 'll have to fall back on the Super Soaker .,1
13853553_1,592575,1391,0,hate,Hopefully they will get deportation orders and be on the next flight back to Cairo .,1
14673273_1,572225,1371,0,hate,Traditionally there have always been a lot of them despite the fact that NE Asians are the extreme version of our breeding strategy .,1
14659168_2,573366,1371,1,hate,They receive housing and welfare at the taxpayer 's expense while breeding like cockroaches .,1
14411050_1,587508,1375,0,hate,The next world cup will be the greatest murder and rape fest since Katrina .,1
13621261_7,579371,1393,0,hate,May they be put away for good .,1
13488146_2,585682,1395,2,hate,We are more concerned about ZOG controlling US and Russia .,1
14035106_1,582213,1387,0,hate,Look at this cultural incongruity from Plymouth . VIDEO : Plymouth celebrates St George 's Day with music and dancing in the streets | This is Plymouth,1
30458837_2,734895,1348,1,hate,A lot of white women are trying to create danger by drawing these other people into our countries .,1
13459148_2,582330,1347,1,hate,Once again  blacks showing they cannot control themselves .,1
13867457_2,579436,1391,0,hate,When I hear the term `` American ''  I think of yahoos who are every color of the rainbow and who start wars in the Middle East for Israel 's benefit .,1
30511208_1,572037,1388,0,hate,Whites wo n't exist in Canada anymore they all have left or mixed themselves away basically leaving Canada to become a large ghetto,1
30762980_2,572043,1354,0,hate,I 'm beginning to wonder with all your posts defending the greatest race-traitor and puppet-of-Jewry that Great Britain has ever produced .,1
13563834_2,580949,1347,1,hate,The natural royality of the planet was not the posing apes  but the Overman .,1
30415022_1,575936,1359,0,hate,I was going to say - before you added that last line - they look like a bunch of frightened monkeys with guns ....,1
30394464_2,576945,1396,0,hate,And here 's what David Irving 's site offers on Hitler 's Table Talks .,1
31777632_1,586973,1363,0,hate,It's a good to add a hint of truth in your essay 's but maybe you have it better off then I did at high school  every teacher I had was very liberal and anti-racist  and could barely accept the truth .,1
12834493_1,572058,1396,0,hate,She may or may not be a Jew but she 's certainly stupid  she seems to think the Blacks wo n't kill her alongside every other White they can get their dirty hands on  what a muppet !,1
31495527_1,578002,1345,0,hate,Yeah she 's gonna end up just like the last hoe bag that got involved with the same chimp .,1
12882281_1,577081,1345,0,hate,This family that wants to complain about gays should come to San Francisco and raise some hell at these gay pride events .... a much better target ..... and these people in San Francisco openly blasphemied Christ with their parody of ' The Last Supper `` as their poster for their last event .,1
14678374_2,604930,1371,0,hate,So therefore they 're not the dumb brutes like blacks are .,1
14109373_1,600437,1381,1,hate,I'm looking for a white enchanting girl  That I can have by my side  . through the thick filth that us americans go through and the best of times aswell .,1
31757290_1,574608,1363,0,hate,Your history teacher has to do what the zionist butt heads want them to do .,1
14673237_1,574041,1371,0,hate,Miami( I do n't know how Don can stand living down there ) Hispanic - 279456 ( 70.0 % ) Black alone - 64993 ( 16.3 % ) White alone - 47622 ( 11.9 % ) Asian alone - 3649 ( 0.9 % ) Two or more races - 2642 ( 0.7 % ) Other race alone - 676 ( 0.2 % ) American Indian alone - 361 ( 0.09 % ) Native Hawaiian and Other Pacific Islander alone - 58 ( 0.01 % ) Read more : Miami  Florida ( FL ) profile : population  maps  real estate  averages  homes  statistics  relocation  travel  jobs  hospitals  schools  crime  moving  houses  news  sex offenders,1
14038566_4,596097,1387,0,hate,Thanks to the imported filth that  like our land under its current occupation .,1
12959694_1,578336,1345,5,hate,Yes he has a red Firebird so the wigger 's parents thought he had promise just like all those fictional characters on t.v.,1
13450081_1,576824,1347,1,hate,Whites in all their glory against impossibly large hordes of non-whites .,1
14671966_2,573247,1371,0,hate,If they want to fire all these leftist moonbats and replace them with genuine White conservatives  I 'm all for it .,1
13595139_1,575845,1393,0,hate,I say let him in and let him rant his mouth with all the Mudslums !,1
14299829_2,579715,1380,0,hate,I 'm in Birmingham  myself and even the nicer suburban area where I 'm from is getting darker and darker .,1
14675480_3,575539,1371,0,hate,Anyways  smearing a single DNA stem with black DNA is horrible .,1
30585975_1,572116,1362,0,hate,yeah maybe if you are Jewish They just warm up the old money printing press when they might feel like they are getting low .,1
31752052_1,626679,1363,0,hate,Maybe blacks are n't better  but their body is more shaped to hunt animals .,1
13290167_1,580749,1345,0,hate,A public execution for these animals would go a LONG way to point to justice being done ; it would never bring the girl back ; but I guarantee it would send a message ............................,1
13857116_1,586778,1391,1,hate,This filth is a sectarian British song not an Irish folk song the sort of scum who wrote and admire this filth have no place on a WN forum yet alone an Irish forum,1
13503863_2,572475,1395,0,hate,I could never picture the site of one of the women of the Holy Rus shacking up with some Islamic mud from that fithy  impoverished  and godforsaken mountainous * * * * hole !,1
31746201_2,599570,1363,0,hate,Bbut they are creeping in slowly seeing more and more these days .,1
14029408_3,575451,1387,0,hate,They 're so close that many believe we interbred  you ca n't interbreed with a chimp .,1
14669086_2,572460,1371,0,hate,Then we will create a Marxist style school system to further dumb them down and reduce them to obedient global citizens .,1
30603583_3,578431,1359,0,hate,He got what he deserved .,1
30561738_1,572144,1362,0,hate,I'm glad you pointed this out that anti-Bullying campaign has been used to promote homosexuals who are more likely to bully anyone who disagrees with them .,1
12871534_1,577234,1346,2,hate,These idiots are doing this to hasten Armageddon so they can get a free ride to heaven .,1
13439833_2,576386,1347,0,hate,It 's a symbol demonstrating a lack of oxygen to the head of all its members .,1
14100549_1,574058,1381,0,hate,I have n't  because I threw out my TV in the mid-1990s when there were to many blacks on TV .,1
13590680_1,579436,1393,0,hate,And now Sweden 's down against the nig nogs ... well at least it was very close  and they only lost in overtime ...,1
13060199_2,579203,1345,0,hate,`` Those evil Whites .,1
31783500_2,599830,1363,0,hate,It makes my flesh crawl when I see white girls having to be felt up as they walk down the hallways by big lipped spear chuckers. : attack,1
14095164_2,590239,1381,0,hate,I too am from cali  but moved out to utah to get away from all the filth .,1
30701099_1,603603,1362,0,hate,I'm sure the Jews in Scandinavia dumb down the education systems there too .,1
30413511_2,734612,1354,0,hate,Maximum resistance towards Zog !,1
12905789_1,578201,1345,2,hate,I think it 's time for some old west justice ... like takin ' these two sombitches out and ..... well  I think you get my point .....,1
31449061_1,572067,1346,1,hate,Marxist Subversion happened .,1
14062533_5,576775,1383,0,hate,Verl : Rechts-Rocker lebt bürgerlich in Verl | Neue Westfälische  Nachrichten aus Ostwestfalen-Lippe  Bielefeld  Gütersloh  Herford  Paderborn  Höxter  Warburg  News  Meldungen  Informationen - Neue Westfälische - Verl For days over Yule  the Zionist controlled press and Antifa scum have been laying siege to Marco from Sleipnir 's family home .,1
14665709_1,572909,1371,0,hate,I've heard that men with AIDS in Africa think having sex with a virgin will cure them .,1
13457765_2,577846,1347,1,hate,It 's going viral on Youtube - warning the lesbian ' groid gets aggressive on the whites for whatever reason : YouTube - Video Caught On Tape Lesbian Or Young Man Going Wild On BART Train In Oakland !,1
30632835_1,605804,1362,0,hate,Our school systems are nothing more then breeding grounds for the slave system the zionist are determined to create .,1
13501379_1,586486,1395,0,hate,I think there is more threat from Russians than from Jews .,1
13857875_1,574905,1391,0,hate,Beware of the falling house prices that Negroes bring with them ( another reason why you 'll never find them living near politicans ) .,1
13594641_1,589801,1393,0,hate,when I was a little kid I used to be in this school and somehow i spoke to this jew. this dude got a narcissistic laugh out of every blonde joke. his favorite was when the blond went to donate semen by using her mouth as container. sad but it 's blonds fault also to let this happen .,1
30771696_1,572847,1354,0,hate,Holocaust is a Holohoax .,1
30537231_2,573598,1362,1,hate,Lay her off and cart her back to India where she can poop in the Ganges river next to her dead grand parents .,1
14279550_3,573505,1380,0,hate,Living in a boarder state  Texas  the problems of illegal aliens is  naturally  a stark reality  and let me add that the only solution that I see is the implimentation of U.S. Troops as guards on the Mexican boarder .,1
12834217_4,572066,1346,0,hate,Click below for a FREE download of a colorfully illustrated 132 page e-book on the Zionist-engineered INTENTIONAL destruction of Western civilization .,1
30496402_1,575397,1388,0,hate,I honestly hate Indians  Muslims  really anything with brown  black or yellow coloured skin I hate .,1
13480152_2,580712,1346,0,hate,We need to eliminate all of those elements from the white race .,1
13843868_2,591203,1391,0,hate,On a short holiday  Go back and do something about your own country and stop putting crap on our doorstep !,1
13848765_1,592436,1391,1,hate,They should be forced to wear the hijab to show that they are different from us .,1
30568938_2,575696,1347,0,hate,Just because we can `` breed '' does n't mean we should .,1
14659168_1,573366,1371,1,hate,The same way they take advantage of the state everywhere else .,1
31755187_1,750212,1363,0,hate,whats up I thought I might put my pic up here I 'm looking for some friends theres too many negroes around here some times I feel like there is' int any white guy left in the world. so message me and let me know there is stll some white brothers out their .,1
14668596_2,579280,1371,2,hate,By their words and deeds  they declare themselves to be staunchly in favor of the genocide of our people .,1
13641599_1,581944,1391,1,hate,We're letting these creatures flow openly through our air and sea ports and not performing so much as a background test on them .,1
14017062_2,577037,1388,0,hate,I was beaten and robbed by two natives last year and over the last couple of years I have watched downtown turn into black  brown and yellow town. the food court at Portage place has started to remind me of the creature cantina from star wars .,1
13455190_1,575082,1347,1,hate,Sadly that is what happens when you dumb down a society and make everything sexual.Not even innocent animals are out of the question for these sickos .,1
14078237_2,581367,1383,0,hate,No wonder this races achieve nothing .,1
30486700_1,734778,1388,0,hate,There is no good in reasoning a bitch that is hungry for a dick.Forget her and let her perish in shame after negroid kicks her after a few tries .,1
31766352_1,587111,1363,0,hate,well im glad to hear there are more youth in our world and lets all hope those mudds and niggs go to h-e-l-l,1
14660182_1,573278,1371,1,hate,Well maybe they 're slowly working their way to destroying Eastern Europe .,1
14661112_1,572285,1371,0,hate,I'm young and viciously angry I 'm not going to lie or apologize for my actions i treat non whites like utter crap and i always have and always will they are n't human in my eyes Anyone who tries to wipe out my race and culture will be met by hostility by me any race who rape and abuse their and my women will be met by hostility and contempt by me WPWW,1
14068441_1,597594,1383,3,hate,All of ukraine is Russia/Poland/Romania  you fake ukrainians .,1
14418441_1,572167,1375,1,hate,Actually it 's not us who 's killing them ... it 's they who are killing us .,1
12842423_2,572506,1397,0,hate,It 's another way to destroy Hungarians on top of promoting * * * * * * music  race mixing and pornography .,1
13450842_2,579071,1347,3,hate,Our enemies have used RACE against us and are currently trying to destroy our RACE through a variety of different means .,1
14670936_1,575683,1371,1,hate,Does it surprise you that those White hating non-whites still want to live in White countries made GREAT by White people and brought low by non-whites ?,1
13288491_1,580733,1345,0,hate,Yes the negroes have been busy the last few weeks but we have to expect it because nothing is being done to them when a crime is committed,1
14026071_1,578591,1387,1,hate,They are no better than their daughters  they should have disowned them instead of parading a kid around town that looks nothing like them .,1
