file_id,user_id,subforum_id,num_contexts,label_text,sentence,label
30438133_2,572057,1348,0,noHate,A Government of Wolves : The Emerging American Police State A Government of Wolves : The Emerging American Police State,0
30756247_1,574948,1362,0,noHate,They will spend 40k plus a year on elementary  middle school  and high school educations all the while crying about poor conditions for non-Whites .,0
30691126_1,588910,1362,0,noHate,1. type of students allowed Aryans only .,0
30704903_5,573581,1362,0,noHate,I have an image in my mind of the soaring vault rising and disappearing into the gray-white silence  the niches in the salt walls where the saints dwelled  the few points of lambent gold glimmering feebly on the altar .,0
14060744_1,572503,1383,0,noHate,Sometimes we are told by our corrupted news that there is a small british colony living in the villages .,0
30532954_3,574914,1348,0,noHate,The Bible is the only true source for end times information and anything else is just human speculation,0
30654504_2,738971,1354,0,noHate,I very much doubt anybody else will ask me because hardly anybody else goes on like you .,0
13586421_11,581207,1393,0,noHate,They show music videos on day time and movies and other shows in the nights .,0
12850415_1,576081,1346,0,noHate,Here is the guy 's blog from the radio station he works at .,0
13612276_2,587084,1393,0,noHate,Providing From Finland does n't kick my ass and throw me overboard ... coming or going .,0
14094605_1,589621,1381,0,noHate,I adore the cold  as long as I can fly down South to walk on the beach when it 's warm .,0
14265509_4,579560,1380,0,noHate,You went there .,0
13479046_2,572817,1345,1,noHate,I pray that their souls are in the heavens and their families are healing in spirit .,0
30542596_7,734656,1354,0,noHate,Far from that .,0
13865393_1,593019,1391,0,noHate,Ironic that they would consider those from Iceland as Germanic when people from Iceland have a 50 % blood link with Ireland due to the Viking slave trade .,0
12856113_1,572976,1346,0,noHate,Pity Nationalists in Britain are busy fighting each other as opposed to uniting and pushing the cause to a wider audience .,0
30428695_1,572408,1348,0,noHate,If that was your DNA test results you posted  and if the methods of the particular testing company are reliable  then your dark coloring may be coming from these components :,0
30654383_1,572231,1354,0,noHate,Truth is welcome who ever speaks it .,0
14675562_2,577118,1371,3,noHate,They can become some of the most anti-white people on earth .,0
14264021_1,572095,1380,0,noHate,It is nearing the end of 2013  so soon I will be starting a thread for the new year .,0
14418706_2,572825,1375,0,noHate,They make you want to go out and reach people .,0
13504235_1,572147,1345,0,noHate,Law & Disorder : ' Missing ' toddler found in gym bag Jacksonville police looking for a missing toddler found the child alive but stuffed in a gym bag locked in the back of a car .,0
13489492_2,585501,1395,0,noHate,Or are the CIA and FSB on the same team ?,0
13850783_2,577024,1391,0,noHate,Well done .,0
13585491_4,581207,1393,0,noHate,http://www.tacitus.nu/historisk-atla ... nter/ryssland/,0
14106209_2,599920,1381,0,noHate,Great Avitar  I need one myself .,0
30688661_1,572266,1354,0,noHate,I do n't know if that is true .,0
14278159_1,573646,1380,0,noHate,These are what I am trying to do .,0
30646027_3,573684,1362,0,noHate,Nice find on ebay as well,0
14264022_2,572095,1380,0,noHate,Happy Holidays From Discover Kalispell - YouTube Christmas Lights in Kalispell  MT - YouTube Christmas Lights in Kalispell  MT - YouTube Christmas Music Kalispell Mt - YouTube,0
30467951_3,572147,1348,0,noHate,X ) `` Stone Family Band : with new in-law at far left and new future in-law at far right .,0
30514286_2,572251,1362,0,noHate,www.third-reich-books.com - English translations of hundreds of Third Reich originals without negative commentary !,0
13484057_2,573474,1345,0,noHate,Judge says `` he 's overly found of children '' and lets him off with slap on wrist .,0
14023805_4,572057,1387,0,noHate,The Prime of Miss Jean Brodie Trailer - YouTube,0
14018324_1,572905,1388,0,noHate,This sounds like a sensible  well thought-out plan .,0
30565021_1,572726,1348,0,noHate,Same here .,0
30415962_1,573346,1362,0,noHate,If you have children or grandchildren ages 12-17  please encourage them to learn about their heritage and history this summer by enrolling in the Knights Party Crusaders Youth Corps through : Youth Corp,0
14266657_2,579231,1380,0,noHate,I do n't think so .,0
14099517_1,573541,1381,0,noHate,I was the child from hell  littlehatekitten and my son is one of the most well behaved children I have ever seen .,0
14038566_2,596097,1387,0,noHate,From what I hear .,0
14031187_1,572512,1387,0,noHate,What's the non-White demographic % in London ?,0
30611457_4,572095,1348,0,noHate,I am giving the whole bag to the kids across the street ....,0
14107653_2,589944,1381,0,noHate,14words mikkke14,0
13468824_1,575539,1346,0,noHate,My old high school that I graduated from has sold its soul to the devil .,0
13586240_1,572043,1393,0,noHate,Btw if anyone wants to have their say against the multikulti zombies that read Six Degrees  here 's their forum : http://www.6d.fi/say _ your _ say/,0
13860252_2,592435,1391,0,noHate,The are quite frankly nothing now .,0
30507680_1,603922,1362,0,noHate,I went to Miss state and only saw 2 jews and they were students .,0
14014847_2,594240,1388,0,noHate,Tons of culture and just great friendly people .,0
14104198_1,599503,1381,0,noHate,Hi i am just looking for whitepride men in the western canada area particularly BC just to talk to hangout or whatever .,0
30799750_1,581606,1362,0,noHate,http://users.erols.com/interlac/corres.htm Check out these schools  most offer high school level courses for credit if the school will accept them you will have to check .,0
13850110_2,586090,1391,0,noHate,As for the ' Oxegen experience '  watch out that your tent does n't get burnt to the ground  like what happened to many people last year .,0
30626401_3,572147,1348,0,noHate,Looked like it was 6 inches tall ; but I saw it .,0
30507538_3,575512,1362,0,noHate,Maybe you 'll find it useful .,0
13452119_2,572977,1347,0,noHate,I 'll have to reread it a few more times to get it clear but thanks for posting this .,0
13271390_2,577040,1345,2,noHate,I have no intention of ever setting foot in Mexico so I 'll have to take your word for it .,0
12857105_3,572893,1346,0,noHate,I hope his God blesses him,0
31741847_2,597994,1363,0,noHate,Face shaved and moustache trimmed ...,0
30491774_3,576855,1362,0,noHate,I am not expecting six figures a year but would like to be comfortable .,0
13071832_3,579408,1345,0,noHate,They are lighter skin Negros now ...,0
13864610_1,578838,1391,0,noHate,And all nonsense .,0
13484016_3,577166,1347,0,noHate,A citizen will have the right to bear arms and encouraged to exercise it .,0
30549353_1,608067,1359,0,noHate,Here is another source for 5.56 They are out of stock on the Wolf garbage but have PMC and some Federal in stock .,0
14109338_2,600429,1381,0,noHate,You now have a new friend from Pembroke Pines  Florida .,0
13484856_1,576000,1345,0,noHate,[IMAGE: Melvin Weiss .,0
14267267_2,572095,1380,0,noHate,I hope they find him .,0
13606532_1,586425,1393,0,noHate,I will go to sleep now  as I have to wake up reasonably early this morrow .,0
13485521_1,575326,1395,0,noHate,Are there any sources that state that it was Trotsky who reiceived the money and was responsible for destruction of Black Hundreds  as opposed to Lenin or another Bolshevik leader ?,0
14110818_2,599484,1381,0,noHate,I 'm 24 yrs old and live in MN .,0
33676864_5,734541,1388,0,noHate,Billy - `` That guy would n't leave me alone  so I gave him the Trudeau salute . '',0
13605248_2,579436,1393,1,noHate,These are much more important in my estimation .,0
31643289_2,599498,1363,0,noHate,Then I might get barbed wire around my wrist .,0
30399327_1,735873,1362,0,noHate,Hi I 'm trying to move myself and my three year old son up to Northern California or even out of state somewhere near woodlands and I am curious if anyone knows about places I might be able to stay for cheap or free or if anyone has a contact .,0
14028381_1,586393,1387,0,noHate,Very easy Rebel Robbie  our bluebells have flowers which droop down  the Spanish variety have flowers that stick out horizontally  and yes they do cross very easily between species which is why people are asked to destroy the Spaniards before they wipe out our own bluebells .,0
13851180_4,592649,1391,0,noHate,Has this situation changed that much ??,0
31711277_3,601322,1363,0,noHate,And this site was resticted on my moms computer so it took me a few days to hack her PW and change that .,0
14083173_2,585426,1381,0,noHate,I 'm too close to the left coast .,0
12871152_1,572479,1346,0,noHate,so they even IDOLIZE a convicted Pedophile and Murderer -- convicted in a public trial -- and established an organization to shield pedophiles and child killers from further scrutiny of American law,0
30980551_2,744084,1346,2,noHate,Most look the same or have the same features .,0
31690213_3,577495,1345,0,noHate,Black guy stabs student  and then slices her throat in front of 30 plus students and faculty  garners barely a mention in the MSM .,0
30623737_7,579195,1362,0,noHate,Some of it is kind of hard to follow  as the japanese have interesting ideas about relationships  dialogue and making ( no ) sense in general .,0
14052954_2,576306,1383,0,noHate,PS .,0
14105130_1,599783,1381,0,noHate,I see all of your goals being accomplished  especially finding a girl to settle down with .,0
13862179_1,589338,1391,0,noHate,not sure where I got them mate  they look like they 're from a magazine though coz they 're scans of photocopies it looks like. will find em and post them,0
30528488_3,572862,1362,0,noHate,But I 've seen it several times in the past two or three years .,0
31173460_2,600025,1363,0,noHate,My family is ok adn they leave me alone but they are pretty liberal. so is my school .,0
12855815_1,572150,1346,0,noHate,Why do people still join Militias ?,0
13843216_2,572307,1391,0,noHate,Check out this interview : http://findarticles.com/p/articles/m ... _ 7576181/pg _ 5/,0
30623580_3,573411,1362,0,noHate,I do not let my children watch tv at all .,0
30623737_6,579195,1362,0,noHate,It features some pretty good  cutting edge anime for mature teens and adults .,0
30645977_2,575696,1362,0,noHate,And it was on my list for middle names for my son .,0
12854553_1,572066,1346,0,noHate,I had to start a new thread seeing as this thread was no longer functioning properly .,0
13497385_1,586291,1395,0,noHate,Edin D eko Bosnian soccer player Zvjezdan Misimović Mismovic and D eko Bosnian President Zeljko Komsic and Angela Lejla Damardzic Bosnian Special Forces OSE Bosnian Street people,0
30580510_2,581720,1348,0,noHate,Never seen them on anyone else but my mother .,0
13594339_1,572043,1393,0,noHate,All of his posts thus far have been rather gratuitous and heavily aimed on Skandinavia alenth with the histories and spirits thereof  particularly the later portion of post #31 .,0
30603434_1,572984,1359,0,noHate,Unfortunately in the United Kingdom we do n't have guns like you Yanks so I was hoping for some alternatives for a SHTF scenario ?,0
14083415_1,575256,1383,0,noHate,If they 're not related  they 're not all Slavs .,0
13504039_4,579435,1345,0,noHate,Investigators believe that Ewell pretended to be a utility repairman to get into the home of Leamond Turnage  69  and his wife Robyn  57 .,0
14097509_3,598917,1381,0,noHate,I am 6 ' 0 around 160lbs 100 % Hungarian. anyone out there ???? 16,0
14026796_2,577642,1387,0,noHate,Hacked website ?,0
13594631_3,589830,1393,0,noHate,Anyway good luck all .,0
14296059_2,585681,1380,2,noHate,Is n't 80 years of failure enough to teach you something ?,0
13547398_1,580757,1345,0,noHate,Just got turned on to a website from a friend of mine .,0
13481130_2,572154,1346,0,noHate,Im on youtube trying to find it right now .,0
14675559_1,577849,1371,0,noHate,Mr. Farkel thinks Whites are too stupid to be doctors and if we had an all White society we would have no doctors and no one to pull our teeth out .,0
13506478_1,572490,1395,0,noHate,Hello Oleg If I did not know I would have thought it is a picture of one of our boer families here in south africa : - ) regards joe,0
14093987_2,574818,1381,0,noHate,There 's a name from the past !,0
31775702_3,577351,1363,0,noHate,I lived by what is or was the Union 76 truckstop and the T/A truckstop off of Milliken Avenue exit on I-10 .,0
14428276_2,600342,1375,0,noHate,Organize and take action. you have other whites around you  bring them together .,0
30474363_1,580743,1354,0,noHate,Form Letter to Send to German Government on Behalf of Ernst Zundel .,0
13451430_1,582250,1347,0,noHate,Can you give any examples of progress made by skinheads or the Klan ?,0
14651924_3,572170,1371,0,noHate,I think a lot of black males become conceited by this .,0
14093243_1,585513,1381,0,noHate,Few pics taken this summer ...,0
14676828_1,573598,1371,0,noHate,You sound very similar to Satan in the New Testament when he was tempting Jesus to abandon God by offering him wealth and power .,0
14018061_2,579386,1388,0,noHate,I was in the Taiwan airport and the whole plane was East Indian .,0
30474363_3,580743,1354,0,noHate,Help keep this case alive,0
14439130_1,578055,1375,0,noHate,For those who like to pass out papers The Nationalist Times is looking for you !,0
30794651_2,572128,1362,0,noHate,You are almost certain to hear a few negro kids say they want to be `` rappas '' or `` basketball playas . '',0
12883101_2,577823,1345,4,noHate,Welcome to the front lines ...,0
14655279_1,572874,1371,0,noHate,I'm not wasting my time watching that .,0
14112552_1,600753,1381,0,noHate,right on !! i want a lil ' rotweiler  when i het one his/her name will be schatzi !! aww cause it will be my sweetie !!! - val ! ( i love that smiley ! ),0
30701160_1,578887,1362,0,noHate,Some Universities have a substantial number of lectures available for free online .,0
14064971_1,575982,1383,2,noHate,I think you all got your way  and they closed down the German minority in Upper Silesia thread under Activism and Politics in Europe .,0
30790770_1,572308,1362,0,noHate,Little Miss Little Miss Muffet sat on a tuffet Eating a Big Mac and fries Along came a spider and sat down beside her ' Yuck '  it said  ' I prefer flies ' .,0
14032605_1,593795,1387,0,noHate,Hi brothers and sisters  i live in wiltshire so if there is anyone else here from wiltshire let me know .,0
13621261_9,579371,1393,0,noHate,Wolf 278,0
13844590_1,590544,1391,0,noHate,That was a wonderful article by Kevin Myers .,0
13462686_8,575159,1347,0,noHate,Anyways if proven wrong by extensive genetic and anthropological evidence  I will accept the view that to be considered white you must be of pure European ancestry .,0
30790752_2,574050,1362,0,noHate,I 'm going off to college in about 6 months and i 'm wondering how you college guys prepared for it/payed for it. any tips ?,0
13461061_2,575534,1346,0,noHate,Non-Muslim Michigan High School students wear hijabs in school for class lesson to `` explore religion and identity '' | Pamela Geller  Atlas Shrugs,0
30491774_1,576855,1362,0,noHate,Did they have pretty good lives ?,0
14673542_4,572387,1371,0,noHate,It reminded me of a bar-room shootout in old Westerns .,0
12851205_1,576176,1346,2,noHate,It's sad when the stupid petitions get filled in 2-3 weeks like that one to build the death star .,0
30565018_1,572842,1348,0,noHate,Football by itself is not bad .,0
14411262_2,579088,1375,0,noHate,Is the time now ?,0
13582449_10,589659,1393,0,noHate,Try buying some of the `` Carolus Rex '' compilations .,0
30542503_2,572977,1354,0,noHate,Thank you to all who posted them .,0
13608459_1,581214,1393,0,noHate,Could a Norwegian poster give us Non Norwegains a quick run through of the likely or possible turnout of the Election .,0
14053109_2,575982,1383,0,noHate,Kapela OSP Radawie g.Z,0
12854553_2,572066,1346,0,noHate,See the new thread @ https : //www.stormfront.org/forum/t989503/,0
30625900_2,573148,1346,0,noHate,If a third world savage attacks a Jew  is it all Jewey 's fault ?,0
14110372_4,600299,1381,0,noHate,OK bye !,0
14109104_1,572043,1381,0,noHate,What I find to be a joke is that someone would take it seriously and post absolute nonsense and crap about this site  without checking it out first .,0
30486701_1,735180,1388,2,noHate,I wonder what these race mixers are thinking ?,0
13455402_4,582379,1347,0,noHate,I 'm not saying `` do n't go out of your house and do n't talk to anyone '' but it 's really important to stay grounded with a group who are n't part of the mass. It 's much easier to remain independent and avoid being caught under the stampede if you have a reminder that you are n't the only person who 's not part of the mass. Uuuugh !,0
30780354_2,574070,1354,0,noHate,I 'm 5 ' 7 "  pudgy with a gut and soft muscles  and I 've wrestled and over-powered bigger  ripped black guys and submitted them .,0
14302330_1,572210,1380,0,noHate,You can have chickens in your back yard here in town in Kalispell .,0
14072114_2,578889,1383,0,noHate,Other shooting at protester Shooting to people in Kiev / ???????? ?? ???????????? ? ?????,0
14268247_3,572068,1380,0,noHate,Just Google it and you 'll see what I mean .,0
14302429_3,576731,1380,0,noHate,I have n't rode a bus since .,0
13585432_3,586425,1393,0,noHate,--------------- > Again the same average person without special education  can understand 40 % of the text of the Iliad written in Archaic Ionian Greek approximately two thousand nine hundred years ago .,0
13511105_2,577743,1345,0,noHate,Damian Brown  26  was taken into custody by East Baton Rouge Parish sheriff 's deputies and charged with identity theft after officials at Scotlandville Elementary say he put three different social security numbers on his applications .,0
13196001_1,573486,1345,2,noHate,I was hoping that at least one of those animals would get their heads lobbed off by the propeller blades like in Dawn of The Dead .,0
14650949_1,574041,1371,0,noHate,Suspect also linked to 2009 murder rape case ..,0
30554924_1,578499,1359,1,noHate,Its gone full retard now .,0
13480228_3,572128,1345,0,noHate,http://www.wavy.com/Global/story.asp?S=6591380http://content.hamptonroads.com/stor ... 5810 & ran = 71385,0
13867769_1,592767,1391,0,noHate,Just for the record is this the same Journalist that wrote the article a few weeks ago telling us to mongrelise ?,0
30497977_1,618934,1347,0,noHate,Aw c 'mon Hillary is a babe .,0
13600800_2,589256,1393,0,noHate,Voice of sanity speaking at last on SF !,0
13622449_3,585974,1393,2,noHate,I refuse to believe it !,0
14678308_1,572285,1371,0,noHate,The Boers will be free in their Volkstaat by then and they can show us how their ancestors carved a civilization outta nothing,0
30598978_1,598852,1362,0,noHate,If there is anything I can do to help  let me know .,0
30446292_3,572841,1359,0,noHate,Thinking about getting a CCW .,0
13480343_1,573459,1345,0,noHate,If you click on the new nation news link at the bottom of my post your will go to a website full of white victims of black crime .,0
30645545_1,575534,1359,0,noHate,Shows me that you 've probably never trained in jiu-jitsu .,0
30559299_1,572544,1354,0,noHate,All that stuff makes for Good TV ........ The shows Great and keep you on Pins and Needles .,0
13863483_1,581188,1391,0,noHate,The History channel had something on about what your talking about .,0
30739023_16,572817,1362,0,noHate,Maybe it would give him a better appreciation for math if he actually applied it to something while he was having fun .,0
14271321_1,600297,1380,0,noHate,To be honest I have not heard in yrs of any skinheads beating anyone up what a shame it should be an everyday event .,0
30461427_1,575855,1359,0,noHate,Neither of the Diaz brothers are very bright but they generally come to fight .,0
30631759_1,574140,1359,0,noHate,Since the other thread is getting to long and bugging out  it 's time to start a new one  I 'll start it off with this ; Preparedness I,0
13507437_3,575149,1395,0,noHate,Though i am from younger generations  these are my father words .,0
30560741_2,574041,1359,0,noHate,Some so remote  you will hear coyotes  and see the night sky as never before .,0
30548905_1,575351,1359,0,noHate,Lars Andersen simply must be cast as an Elf by Peter Jackson in new Hobbit Lord Of The Rings movies .,0
31735172_1,577415,1363,0,noHate,My God .,0
12883017_1,576824,1345,0,noHate,For ten dollars it would give me some entertainment .,0
13851180_2,592649,1391,0,noHate,I stayed in Ballina and saw almost no foreigners at all .,0
13164908_1,572144,1345,0,noHate,I only clicked on the article hoping it was I white baby and as usual I was disappointed .,0
30611264_4,574754,1348,0,noHate,Imagine if I got 100 percent negro .,0
30622912_6,580712,1359,0,noHate,Instead I am seeing this tiny percentage of black wrestlers taking all the MMA spots .,0
14033650_2,595890,1387,0,noHate,Why Bedfordshire Needs Kevin Carroll as Police Commissioner,0
13589956_5,572289,1393,0,noHate,Miss Germany looks southern too .,0
30623660_1,572449,1362,0,noHate,Thank you !,0
13475603_1,583610,1347,0,noHate,These two elements in your comment are quite baffling .,0
30623737_3,579195,1362,0,noHate,The `` Dragonball Z '' hairstyle is all the rage amongst the 12-14 yr old boys  too .,0
12905790_2,578244,1345,2,noHate,Let 's order a pizza to be delivered where we are and then try to assault the driver  no one will know how to catch us .,0
30461401_1,594327,1359,0,noHate,If a J frame .38 wont deal with it  you should n't be screwing with it without a long gun .,0
13468181_1,572206,1345,0,noHate,if you have enough money for high speed internet to download it you can probably afford the book ! you have your priorities mixed up if you have high speed internet which you 'd need to d/l it but cant feed your kids  lol .,0
14430526_1,576945,1375,0,noHate,The British Protestants built strange communities in Northern Ireland  and the Irish Catholics said : `` What is happening here ? '',0
14103292_3,599555,1381,0,noHate,I was begininning to feel alone out here in SoCal !,0
14439692_1,599759,1375,0,noHate,I have a suggestion for distribution of your collection .,0
13589077_3,589887,1393,0,noHate,I 'm very grateful for all help .,0
30603583_1,578431,1359,0,noHate,Disagree.,0
30659678_10,576682,1359,0,noHate,Shoot a pre merger Thompson Center Hawken 50 .,0
14032740_10,574284,1387,0,noHate,There was not one white child amongst them .,0
14089145_3,598330,1381,4,noHate,Works for me .,0
13843333_1,585858,1391,0,noHate,Maybe it 's about time for groups of white people to renounce their citizenship .,0
13488239_3,575829,1395,0,noHate,Beautiful ship !,0
14672794_1,614412,1371,0,noHate,Did you register an account on this site just to call these people white supremacists/call them stupid ?,0
30765084_1,581674,1362,0,noHate,Take pics of blacks  junkies and gangsters on the streets and next take pics of the schools .,0
30729304_2,576058,1362,0,noHate,Burger King was next up .,0
30585975_2,572116,1362,0,noHate,The rest of us Goyim : we have to break our backs making up the inflation difference .,0
13472697_3,579059,1346,0,noHate,Ca n't have that .,0
30591002_2,572266,1348,0,noHate,Has anybody watched the video and listened to him ?,0
30491832_1,575970,1362,0,noHate,Teachers Combine Math With Social Justice Lessons - The College Fix Meanwhile in the other side of the world ...,0
14302342_2,572095,1380,0,noHate,It 's 93 right now here  but 81 there .,0
30713735_2,741032,1362,0,noHate,Anyone remember the yamoto ? youtube : japanese battleship yamoto If they had enough oil to run the thing  they would have taken over the entire ocean .,0
13850039_1,590562,1391,0,noHate,As a white nationalist I personally would not pay to watch the likes of that drug addict Amy Winehouse or scum like Rage Against The Machine .,0
14038266_2,576637,1387,0,noHate,It 's nice to see other people here in this section that lean towards the old Pagan beliefs too .,0
13481788_2,584941,1346,0,noHate,Learning how to find good TV shows online and watch what I want when I want has tripled my quality of life .,0
13866882_1,572289,1391,1,noHate,Of course if people would stop going to these places then they would never be able to earn enough money to start up foreign cesspits in Irish towns .,0
13473247_4,583605,1346,0,noHate,I have seen young white girl 's and boy 's acting like blacks with their baggy pant 's and their hip hop .,0
12843993_1,572794,1396,0,noHate,My heart goes out to you ..,0
30451877_3,572043,1388,0,noHate,Even if it 's all black or all Pakistani  that 's somehow `` diverse '' .,0
30444110_9,574197,1348,0,noHate,I feel as though this border should be much  much further south .,0
13866620_1,586589,1391,5,noHate,Make sure you have a security team for Justin Barrett whenever he speaks in public in case the unwashed scum try anything again .,0
30421625_2,736708,1396,0,noHate,The people running SA into the ground  want to wipe them all out .,0
30473423_3,573347,1348,0,noHate,Cheaper too .,0
14038723_1,579969,1387,0,noHate,When I started learning about Hitler in school and I was possessed with trying to find out if I was Aryan .,0
14103100_6,599541,1381,0,noHate,MUCH NICER down here. e mail me sometime,0
31785554_1,577884,1363,0,noHate,I've actually noticed that cops tend to share our beliefs more than just about any other government related profession .,0
13349494_2,577232,1345,0,noHate,Please do n't use the fallacy of authority either .,0
14669890_2,572638,1371,0,noHate,And you will find it too  just like you have so many times before . . .,0
14284240_2,572043,1380,0,noHate,We 'll win that way ...... LOL,0
14658510_2,614248,1371,0,noHate,I mean whites are offsprings of Homo sapien & Neanderthal hybrids .,0
