"","title","contents"
"70","수원대 네덜란드 잼버리 대원 체육 문화 프로그램 진행","  수원대는 8일 입소한 840여 명의 네덜란드 잼버리 대원들을 위해 체육 문화 프로그램을 진행했다고 11일 밝혔다. 네덜란드 잼버리 대원들은 11일 오전 화성 종합경기타운 실내체육관에서 수원대 여자 농구부원들과 농구의... "
"71","'정규직 파트타임 천국' 네덜란드…60세도 ""은퇴 아직 멀었죠""","  더 나이가 들면 ‘파트타임’으로 근무하거나 재능 기부하며 살아갈 계획입니다.” 네덜란드 공공기관... 지난 6월22일(현지시간) 네덜란드 로테르담 센트럴역 앞에서 에드윈 존더(Edwin Zonder) 브라반트 개발청(BOM)... "
"72","수원대학교, 네덜란드 잼버리 대원 음악 문화 프로그램 진행","  명의 네덜란드 잼버리 대원들을 위해 음악 문화 프로그램을 진행했다. 10일 오후 국악 체험 프로그램으로 시작되었다. 수원대학교 국악과 교수와 학생들이 가야금, 아쟁, 해금 등을 연주하며 네덜란드 잼버리 대원들에게... "
"73","신나는 K-pop 댄스, 열정적으로 춤추는 네덜란드 대원들","  = 7일 오후 2023 제25회 새만금 세계스카우트 잼버리 델타구역 대집회장에서 '새만금 갓 탤런트' 행사에 참가한 네덜란드 대원들이 케이팝(K-POP) 댄스를 선보이고 있다. 2023.8.7/뉴스1 "
"74","네덜란드 산양 분유 카브리타, 8월 초성퀴즈 이벤트","  담원인터내셔널 자사가 수입 유통하는 네덜란드 산양 분유 '카브리타' 주제로 초성 퀴즈 이벤트를 진행한다. 카브리타 8월 초성퀴즈 이벤트의 자세한 사항은 카브리타 공식 인스타그램 계정을 통해 확인 할 수 있다.... "
"75","수원대학교, 네덜란드 잼버리 대원 대상 ‘역사·문화 프로그램’ 진행","  장희주 조선에듀 기자 | 수원대학교(총장 임경숙)는 840여 명의 네덜란드 잼버리 대원들을 위해 역사·문화... 오늘 10일에는 잼버리 네덜란드 대원들이 신텍스로 이동해 영화 ‘미니언즈 2’를 시청했다. 대원들은 직접 앉을... "
"76","수원대 840여 명의 네덜란드 잼버리 대원들 대상 숙식 제공","  수원대는 8일 입소한 840여 명 네덜란드 잼버리 대원들을 위해 기숙사와 식사를 제공했다고 9일 밝혔다. 네덜란드 잼버리 대원들은 8일 오후 12시부터 시작해 오후 5시 전원 도착했으며 도착 즉시 기숙사를 배정받았다.... "
"77","美, 덴마크·네덜란드의 F16 전투기 제공 승인...가동 미지수 속 반쪽 전략? ...","  미국이 덴마크와 네덜란드에서 우크라이나로 F-16 전투기를 보내는 것을 승인했다. 17일 로이터통신이 미 정부 관리의 말을 인용해 이같이 보도했다. 미국 정부 관계자는 토니 블링컨 국무장관이 덴마크와 네덜란드 측이... "
"78","닭고기 수급 불안에 네덜란드 종란 첫 수입","  정부 주도로 17일 하림과 동우팜투테이블 등을 통해 국내로 들어오는 종란은 네덜란드산 500만개다. 향후 부화(부화율 통상 82%)한 400만 마리의 병아리를 농가에 공급, 국내산 닭으로 키워 공급 부족을 해결한다는 게... "
"79","화재사고 日자동차선 네덜란드 항구로 이동","  HIGHWAY)호가 네덜란드 에임스하번(Eemshaven)항에서 10월 중순까지 조사를 받을 예정이다. 선박 소유주인 일본... 쇼에이기센은 사고 선박은 지난달 31일 오전 11시30분 네덜란드 아멜란트섬과 스히르모니코그섬에서... "
"80","융릉과 건릉 숲길 걷는 잼버리 네덜란드 대표단","  9일 세계스카우트 잼버리 대회의 네덜란드 대표단 800여 명이 각각 400명씩 2개 조로 나눠 경기도 수원시 소재의 사적 '화성 융릉과 건릉'을 방문해 경내 숲길을 걷고 있다. 2023.8.9 [문화재청 제공. 재판매 및 DB 금지] "
"81","네덜란드 해상서 차량 3천대 실은 운반선 화재…최소 1명 사망","  승무원 20여명 모두 대피…침몰 위험에 화재 진압 난항 정빛나 특파원 = 26일(현지시간) 네덜란드 북해 해상을... 화재 지점은 네덜란드 북부 아멜란트섬 인근 해상이다. 네덜란드 해안경비대는 홈페이지를 통해 ""승선원... "
"82","네덜란드서 불 난 화물선, 전기차 500대 선적…진화 작업에 난항","  지난 26일(현지시간) 네덜란드 북부 해안에서 화재가 발생한 화물선에 당초 보고된 25대보다 스무 배 많은 약... 앞서 프리맨틀호는 26일 오전 0시쯤 네덜란드 아멜란트섬으로부터 14.5해리(26㎞)가량 떨어진 해역을 지나던... "
"83","[단독]원스토어, 8월 내 유럽법인 신설…네덜란드에 거점 세운다","  원스토어는 이달 내 네덜란드에 거점을 둔 유럽법인을 출범시킨 후 본격적으로 글로벌 사업 전진 기지를 구축할 계획이다. 1일 <블로터> 취재 결과, 원스토어가 이달 내 네덜란드에 위치한 '원스토어 인터내셔널... "
"84","네덜란드, 화재난 화물선 임시 예인…인근 생태계 오염 우려","  네덜란드 앞바다에서 1주일 동안 불이 붙은 채 떠 있는 대형 화물선이 사고수습을 위해 예인돼 임시 장소로 옮겨졌으나 인근 다도해 지역의 오염이 우려된다. 지난달 31일(현지시간) 영국 일간 가디언에 따르면 네덜란드... "
"85","[포토] 네덜란드 암스테르담서 성소수자 행진","  = 2일(현지시간) 네덜란드 암스테르담에서 시민들이 무지개 깃발을 들며 '프라이드' 행진에 참여하고 있다. 매년 네덜란드에선 성소수자(LGBTQ) 공동체의 다양성을 기념하는 '프라이드' 행진이 진행된다. 2023.08.02 "
"86","'1700만명 小國' 네덜란드의 반도체 독주…그 뒤엔 '이 협약' 있었다","  유럽의 소국(小國)인 네덜란드가 미국도 무시할 수 없는 제조업 강국으로 발돋움할 수 있었던 배경에는 1982년 타결한 ‘바세나르 협약(노사정 대타협)’이 있다. 이 협약이 없었다면 네덜란드의 역사는 지금과 완전히... "
"87","네덜란드, 한 경기 최다 '7골'…조 1위로 16강","  FIFA 여자월드컵에서 우승 후보 네덜란드가 이번 대회 한 경기 최다인 7골을 몰아치며 베트남을 대파했습니다. 지난 대회 준우승팀 네덜란드는 월드컵 본선에 첫 출전한 베트남에 전반에만 5골을 몰아쳤습니다. 전반... "
"88","수원대 네덜란드 잼버리 대원 관리/지원","  수원대는 8일 입소한 840여 명의 네덜란드 잼버리 대원들이 안전하게 집으로 돌아갈 수 있도록 마지막까지 관리와 지원을 했다고 최근 밝혔다. 12일 오전 4시부터 진행된 네덜란드 잼버리 대원들의 퇴소는 수원대... "
"89","'EPL 입성' 네덜란드 레전드 아들 ""손흥민 활약 보고 싶다""","  프리미어리그에서 활약하게 된 네덜란드의 공격수 저스틴 클루이베르트가 손흥민과의 만남에 대해... 저스틴 클루이베르트는 지난 2016-17시즌 아약스(네덜란드)에서 프로 데뷔전을 치른 후 그 동안 AS로마(이탈리아)... "
"90","전소미 ""네덜란드·캐나다·한국 3개국 여권 보유…거의 무적""","  가수 전소미가 네덜란드, 캐나다, 한국까지 3개국 여권을 보유해 해외 일정을 수월하게 소화할 수 있다고... 캐나다와 네덜란드 이중 국적이고, 엄마는 대한민국 국적이다. 제가 여권이 3가지 있다""고 말했다. 전소미는... "
"91","'담양 쌀 세계화'...네덜란드·체코 이어 프랑스 진출","  전남 담양군에서 생산되는 쌀이 네덜란드와 체코에 이어 프랑스에 진출하며 유럽인의 입맛을 사로잡는다.... 이번 수출은 올해 1월 네덜란드와 체코에 담양 쌀 60t 수출에 이은 유럽 수출로, 최근 한류의 위상이 높아지고... "
"92","데이터로 '충전기 천국' 만든 네덜란드…""전기차도 휴대폰처럼""","  머니투데이는 전기차 시장 선도국 중 노르웨이와 네덜란드의 사례를 들여다 봤다. 충전 인프라가 취약해도 전기차 판매율 1위국이 된 노르웨이, 충전 인프라 확충으로 전기차 보급률을 끌어 올린 네덜란드의 사례가 줄 수... "
"93","美·네덜란드 반도체 제재에…中 28나노 노광장비 자체 개발","  중국의 거의 유일한 반도체 노광장비 제조사인 SMEE는 미국·네덜란드·일본 등이 잇달아 대중국 첨단... 다만 SMEE가 개발한 심자외선(DUV) 노광장비와 네덜란드의 세계 1위 반도체 노광장비 제조사인 ASML이 독점 생산... "
"94","근본 넘치는 판 더 펜, ""아약스·네덜란드 출신 많은 토트넘...베르통언 보고...","  네덜란드 선수들도 마찬가지다. 그 덕분에 토트넘 경기를 많이 봤다. 솔직히 말해 베르통언이 아약스에서 뛸... 판 더 펜은 네덜란드 에레디비시 폴렌담에서 성장한 다음 볼프스부르크로 이적해 독일 분데스리가에... "
"95","‘최강’ 미국, 네덜란드와 혈투 끝 1-1 무승부[여자월드컵]","  붙었던 네덜란드와 가까스로 무승부를 거뒀다. 미국은 27일 뉴질랜드의 웰링턴의 웰링턴 리저널 스타디움에서 열린 2023 국제축구연맹(FIFA) 호주·뉴질랜드 여자월드컵 조별리그 E조 2차전에서 네덜란드와 1-1로 비겼다.... "
"96","'111분 결승골' 스페인, 네덜란드 꺾고 준결승 선착[2023 여자월드컵]","  네덜란드를 꺾고 2023 국제축구연맹(FIFA) 호주·뉴질랜드 여자월드컵 4강에 가장 먼저 올랐다. 스페인은 11일(이하 한국 시각) 뉴질랜드 웰링턴의 리저널 스타디움에서 펼쳐진 2023 여자월드컵 8강전에서 네덜란드를 2... "
"97","[포토] 잼버리 네덜란드 스카우드 용인 현대차그룹 숙소로 입소","  2023 새만금 세계 스카우트 잼버리에서 조기퇴영한 네덜란드 스카우트 대원들이 8일 오후 용인시 마북동 현대차그룹 인재개발원으로 향하고 있다. 태풍 '카눈'이 한반도에 상륙할 것으로 전망되자... "
"98","최승우, UFC 싱가포르 대회 출격...네덜란드 킥복서 에렌스와 격돌","  8kg) 경기에서 킥복서 야르노 에렌스(28∙네덜란드)와 맞붙는다. 3연패 후 마지막이 될 수도 있는 기회를... 이번 상대는 네덜란드 출신의 킥복서 에렌스다. 어렸을 때부터 유도 사범인 아버지로부터 배워 유도 검은띠도... "
"99","네덜란드 산양 분유 카브리타, 쿠팡, SSG 등 새벽 배송 시작","  담원인터내셔널은 최근 네덜란드 산양분유인 '카브리타'를 쿠팡 및 SSG 등을 통해 새벽 배송을 시작한다고 밝혔다. 카브리타는 전 세계 프리미엄 산양 분유 브랜드로 과거 LG생활건강을 통해 수입 판매가 됐지만, 지난해... "
"100","[사람과 생각] 김주원 연암대 차세대농업기술센터장 ""농업 선진국 네덜란드의...","  김주원 연암대 차세대농업기술센터장이 지난 6월 청년 영농인재 12명과 함께 농업 선진국인 네덜란드를... 선진국 네덜란드를 살피고 돌아온 사실이 대학가에서 화제가 되고 있다. 이들은 모두 연암대 스마트원예계열에... "
