"","title","contents"
"70","선문대, 슬로바키아 슬로박 공대와 글로벌 캡스톤디자인 공동 수업","  선문대를 포함한 DSC 지역혁신플랫폼 사업단 융합전공 참여 학생들이 슬로바키아 슬로박 공대에서 글로벌... 선문대 지능형전장제어시스템 사업단(단장 최창하)은 지난달 29일부터 지난 9일까지 12일간 슬로바키아... "
"71","北 국방상, 북·러 무기 거래 부인 없이 “정상적 협조”","  최근 북한과 러시아 간 무기거래를 지원한 슬로바키아 국적자가 미국과 영국으로부터 동시에 독자제재 대상에 오르는 등 국제사회는 북·러 무기거래를 북한의 핵·미사일 자금원 뿐만 아니라 우크라이나 침략전쟁을... "
"72","부차 방문한 젤렌스키와 슬로베니아-몰도바-크로아티아-슬로바키아 정상","  31일(현지시간) 탈환 1주년을 맞은 키이우 인근 부차의 기념식에 로버트 골롭 슬로베니아 총리, 마이아 산두 몰도바 대통령, 안드레이 플렌코비치 크로아티아 총리, 에두아르트 헤거 슬로바키아 총리와 참석을 하고 있다. "
"73","미, '북·러 무기 거래 시도 주선' 슬로바키아인 제재(종합)","  주선한 슬로바키아인을 제재했다고 30일(현지시간) 밝혔다. 미 재무부 해외자산관리국(OFAC)은 이날 ""북한과 러시아 간의 무기 거래를 도운 혐의로 슬로바키아 국적 아쇼트 므크르티체프(Ashot Mkrtychev)를 제재했다""고 미... "
"74","[속보] 美, 북·러 무기 거래 관여 슬로바키아인 제재","  = 美, 북·러 무기 거래 관여 슬로바키아인 제재 "
"75","美재무부, '북한-러시아 무기 거래' 관여 3개 단체 제재","  (Verus), 슬로바키아 업체 '베르소'(Verso S.R.O), 카자흐스탄 유한회사 '디펜스 엔지니어링' 등 3개 단체에 대한 제재를 발표했다. 재무부는 지난 3월 30일 북-러 무기 거래를 중개한 슬로바키아 국적인 아쇼트... "
"76","홍현석, UECL 플레이오프 1차전에서 시즌 마수걸이 골","  질리나(슬로바키아)와 콘퍼런스리그 2차 예선 1차전에서 5대1 대승을 거둔 덕분에 2차전만 교체로 출전했고, 나머지 8경기(주필러리그 4경기) 모두 선발 출전이었다. 홍현석은 후반 추가시간 쐐기골을 터뜨렸다.... "
"77","기아, 슬로바키아 질리나大과 교육·연구 협력","  기아가 슬로바키아 공장 효율성 향상을 위해 질리나대학교(University of Žilina, UNIZA) 인재 육성에 나선다. 인턴 프로그램 등을 통한 인적 자원을 확보할 예정이다. 기아 슬로바키아 법인은 26일(현지시간) UNIZA와 산학협력... "
"78","영국, 러 군 공급업체 등 25개 개인·단체 제재","  두바이, 슬로바키아, 스위스 등에 기반을 둔 개인 및 단체다. 제재 대상 중에는 러시아에 전자제품, 드론 등을 수출한 방위장비 생산업체 등이 포함됐다. 아울러 북한, 러시아 간 무기 거래 시도에 연루된 슬로바키아... "
"79","美, 북러 무기거래 관련 3개국 기관 제재..韓 “독자제재 검토”","  미 재무부 해외자산통제국(OFAC)은 16일(현지시간) 러시아 소재 베루스를 포함해 슬로바키아 국적의 베르소... 므크르티체프는 슬로바키아 국적자로 미국·영국을 비롯한 각국에서 이미 제재 명단에 이름이 올라 있는... "
"80","한국공대, 체코·슬로바키아 명문 공과대학들과 업무협약 체결","  한국공학대학교 SW대학은 지난 11월 28일부터 12월 1일까지 체코 프라하 소재의 체코기술대(CTU)와 부르노 소재의 부르노기술대(BUT), 슬로바키아 브라티슬라바 소재의 슬로바키아기술대 (STU)와 교육과 학술교류 등의... "
"81","슬로바키아 디스플레이 시장 동향","  동향 슬로바키아 LCD, LED TV, Smart TV를 포함한 디스플레이 시장은 2022년 추산 1억 8,100만불... 슬로바키아는 국민의 삶의 질을 높이기 위한 전반적인 현대화를 시도하는 중이다. 그... "
"82","슬로바키아 휴대폰 시장 동향","  동향 슬로바키아 휴대폰 소매시장의 규모는 8억 2,540만 유로로, 2022년 유럽 연합 27개국 중 16위를 기록했다. 2017년 해당 산업은 15위를 기록한 바 있다. 슬로바키아 휴대폰 소매 시장 규모는 2017-2022년... "
"83","2023 제1회 세계족구대회, 이기흥 회장 “저비용 고효율의 토종 족구, 세계화...","  3일간 강원도 양구 문화실내체육관과 국민체육센터에서 열린다. 전세계 11개국(체코,아일랜드,이라크,불가리아,파키스탄,헝가리,라오스,태국,슬로바키아,루마니아,대한민국)에서 약 110여명의 선수가 참가해 우승을 다툰다. "
"84","尹, 에스토니아·슬로바키아 정상과 회담…경제 협력 강조","  차푸토바 슬로바키아 대통령을 ‘약식 회담’ 형식으로 각각 만났다. 윤 대통령은 먼저 칼라스 총리에게... 윤 대통령은 또 차푸토바 대통령과 만나 “130여개 한국 기업이 슬로바키아에 진출해 양국 간 경제 협력이... "
"85","기아·현대모비스, 슬로바키아 '톱10' 기업 등극…작년 최대 매출·이익 달성","  현대모비스가 슬로바키아 최대 기업 '톱10' 목록에 이름을 올렸다. 지난해 적극적인 활동을 지속한 결과 매출과 순이익이 크게 증가한 것으로 나타났다. 12일 슬로바키아 기업정보데이터제공업체 Finstat에 따르면... "
"86","이런 차를 중국서 먼저 팔다니?, 청두서 공개된 준중형 전기 SUV 'EV5 '","  기아 관계자에 따르면 EV5는 이달부터 중국 염성공장에서 현지 생산되며, 빠르면 2024년에 국내와 기아 유럽 생산기지인 슬로바키아 공장에서도 생산될 예정이다. 기아는 26일부터 9월 3일(일)까지 진행되는 이번 2023... "
"87","슬로바키아 탱크 납품 설명하는 람브레히트 독일 국방장관","  20일(현지시간) 슬로바키아 브라티슬라바에서 크리스틴 람브레히트 독일 국방부 장관이 야로슬라프 나드 슬로바키아 국방부 장관이 배석한 가운데 독일 레오파드 탱크의 슬로바키아 납품과 관련된 기자들의 질의에... "
"88","두산스코다파워, 슬로바키아 원전 개선사업 성료","  두산스코다파워가 슬로바키아 모초브체 원자력 발전소를 현대화했다. 발전소 현대화로 수명을 연장하고... 부분인 슬로바키아 모초브체(Mochovce) 원자력 발전소의 터보 기계류에 대한 대대적인 현대화를 완료했다고... "
"89","러시아 대체한 기아 슬로바키아 공장 효율↓...中 경쟁까지 '이중고'","  낙점한 슬로바키아 공장이 난항을 겪고 있다. 전동화 전환 추진으로 생산 속도가 더뎌진 상황에서 중국 브랜드와의 경쟁까지 심화되며 효율이 떨어졌다는 평가다. 13일 슬로바키아 일간 경제지 호스포다르스케 노비니... "
"90","외교부 차관보, 슬로바키아 정무차관보 만나 경제협력 강화 논의","  사진=외교부 제공 윤아경 인턴기자=최영삼 외교부 차관보가 28일 한국을 방한한 미할 파북 슬로바키아... 비세그라드 그룹(V4)은 슬로바키아와 체코, 폴란드, 헝가리 등 중유럽 4개국 간 지역 협의체로 현재 의장국은... "
"91","재무 성과로 알아보는 슬로바키아 소비재 유통체인","  슬로바키아는 소비재 유통 부분에서 여전히 오프라인이 강세다. 코로나19로 인해 이용자 수... 또한 슬로바키아 통계청에 따르면 유통업계에서 2021년 매출액 기준 가장 큰 비중을 차지하는 것은... "
"92","한·슬로바키아 외교당국, 교역·투자 등 경제협력 강화 논의","  의장국인 슬로바키아 외교당국이 28일 내년 수교 30주년을 맞아 교역·투자 등 양국 간 실질협력 방안에 대해 논의했다. 외교부에 따르면 최영삼 차관보는 이날 방한중인 미할 파북 슬로바키아 외교부 정무차관보와... "
"93","박신자컵 여자농구 26일 개막…4개국 10개 팀 우승 경쟁","  박신자 여사는 1967년 체코슬로바키아에서 열린 세계여자농구선수권대회에서 한국을 준우승으로 이끌고, 대회 최우수선수(MVP)에 선정된 농구인이다. 2021년 국제농구연맹(FIBA) 명예의 전당 선수 부문에 아시아 국적... "
"94","김민재 나폴리 '대선배', 슬로바키아 대표 136경기로 마침표…15년 만의 눈물","  미드필더 마렉 함식이 슬로바키아 국가대표 생활을 35세 나이로 마무리했다. 함식이 속한 슬로바키아 축구 국가대표팀은 20일(한국 시간) 슬로바키아 브라티슬라바 나로드니 푸트발로비 슈타디온에서 칠레와 친선... "
"95","체코, 동유럽 V4 국 협의체 의장 ..슬로바키아 이어","  체코 공화국이 7월1일(현지시간)부터 슬로바키아로부터 비셰그라드 4개국 협의체(V4)의 의장국 직위를 이어... V4 협의체는 1991년 2월 15일 유럽 중앙에 위치한 체코슬로바키아, 헝가리, 폴란드 등 3개국 정상회담에서... "
"96","2022년 슬로바키아 지역별 투자지원제도 이해하기","  슬로바키아는 2002년 투자지원기관을 설립한 이후 2021년까지 약 20년간 우리나라의 기아자동차... 슬로바키아의 지역별 투자인센티브 제도를 살펴보면, 목표는 슬로바키아 산업경쟁력 강화와 지역 균형... "
"97","정의선 회장, 국익 챙기려 '동분서주' 슬로바키아 총리 면담","  Heger) 슬로바키아 총리를 만나 세계박람회 부산 개최 지지를 요청하고, 친환경 모빌리티 확대 관련 협력 방안을 논의했다고 30일 밝혔다. 슬로바키아는 비셰그라드 그룹(슬로바키아, 체코, 폴란드, 헝가리 4개국간의... "
"98","슬로바키아, 겨울 에너지 요금 부담을 피하는 방법","  에너지 요금 부담이 느는 슬로바키아슬로바키아에서는 러시아의 가스공급 차질에 따른 난방 및 에너지 요금 상승에 대한 우려가 늘고 있다. ‘22년 1월 대비 8월 기준 전기요금이 두 배 이상 인상되며 가계 에너지... "
"99","정의선 현대차그룹 회장, 에두아르드 헤게르 슬로바키아 총리 만나 부산세계박...","  현대자동차그룹의 정의선 회장이 28일(현지 시각) 에두아르드 헤게르(Eduard Heger) 슬로바키아 총리를 만나 세계박람회 부산 개최 지지를 요청하고, 친환경 모빌리티 확대 관련 협력 방안을 논의했다. 슬로바키아는... "
"100","작지만, 강한 나라 슬로바키아","  슬로바키아에 한국의 스마트화 사례를 소개하고자 한국정부 지원 아래 10월 초 슬로바키아행 비행기에 몸을 실었다. 유럽행 비행기를 타 본 사람은 알겠지만, 유럽은 북극 방향이 가장 가깝다. 하지만, 북한 영공을 통과할... "
